species	seq_id	cds_nt	codon_tokens	num_codons	gc_content	dominant_reference_coverage	avg_window_heterogeneity	sparse_difference_ratio	has_internal_stop	length_group	terminal_stop_policy	sampling_view	regularity_group	regularity_quartile	regularity_bin_n	regularity_q1	regularity_q3	regularity_is_reportable
ecoli	lcl|U00096.3_cds_AAC74347.1_1244	ATGAAAGCAATTTTCGTACTGAAAGGTTGGTGGCGCACTTCCTGA	ATG AAA GCA ATT TTC GTA CTG AAA GGT TGG TGG CGC ACT TCC	14	0.452381	0.291667	0.854167	0.000000	false	L2_short	drop_stop	balanced	high_regularity	q3	33	0.208333	0.291667	false
ecoli	lcl|U00096.3_cds_AAC74785.1_1709	ATGAATGCTGCTATTTTCCGCTTCTTTTTTTACTTTAGCACCTGA	ATG AAT GCT GCT ATT TTC CGC TTC TTT TTT TAC TTT AGC ACC	14	0.357143	0.375000	0.708333	0.000000	false	L2_short	drop_stop	balanced	high_regularity	q4	33	0.208333	0.291667	false
ecoli	lcl|U00096.3_cds_AAC75079.1_2003	ATGACACGCGTTCAATTTAAACACCACCATCATCACCATCATCCTGACTAG	ATG ACA CGC GTT CAA TTT AAA CAC CAC CAT CAT CAC CAT CAT CCT GAC	16	0.437500	0.312500	0.750000	0.517857	false	L2_short	drop_stop	balanced	high_regularity	q4	33	0.208333	0.291667	false
ecoli	lcl|U00096.3_cds_AAC75647.1_2579	ATGAAACACATACCGTTTTTCTTCGCATTCTTTTTTACCTTCCCCTGA	ATG AAA CAC ATA CCG TTT TTC TTC GCA TTC TTT TTT ACC TTC CCC	15	0.377778	0.267857	0.794643	0.283333	false	L2_short	drop_stop	balanced	mid_regularity	q3	33	0.208333	0.291667	false
ecoli	lcl|U00096.3_cds_ABP93450.1_2448	ATGATTGAACGTGAACTGGGGAACTGGAAAGACTTTATCGAAGTTATGCTTCGTAAGTAA	ATG ATT GAA CGT GAA CTG GGG AAC TGG AAA GAC TTT ATC GAA GTT ATG CTT CGT AAG	19	0.403509	0.236111	0.958333	0.047619	false	L2_short	drop_stop	balanced	mid_regularity	q2	33	0.208333	0.291667	false
ecoli	lcl|U00096.3_cds_ACO59998.1_1998	ATGGGGCAATTTTTTGCTTACGCGACGGTTATCACCGTAAAGGAGAATGACCATGTCGCATAA	ATG GGG CAA TTT TTT GCT TAC GCG ACG GTT ATC ACC GTA AAG GAG AAT GAC CAT GTC GCA	20	0.466667	0.208333	0.958333	0.142857	false	L2_short	drop_stop	balanced	low_regularity	q1	33	0.208333	0.291667	false
ecoli	lcl|U00096.3_cds_ACO59999.1_2059	ATGATGAAGCACGTCATCATACTGGTGATACTCTTAGTGATTAGCTTCCAGGCTTACTAA	ATG ATG AAG CAC GTC ATC ATA CTG GTG ATA CTC TTA GTG ATT AGC TTC CAG GCT TAC	19	0.421053	0.277778	0.916667	0.222222	false	L2_short	drop_stop	balanced	mid_regularity	q3	33	0.208333	0.291667	false
ecoli	lcl|U00096.3_cds_ACO60000.1_2060	ATGATGAAGCTACTCATCATCGTGGTGCTCTTAGTCATAAGCTTCCCCGCTTACTAA	ATG ATG AAG CTA CTC ATC ATC GTG GTG CTC TTA GTC ATA AGC TTC CCC GCT TAC	18	0.462963	0.291667	0.916667	0.166667	false	L2_short	drop_stop	balanced	high_regularity	q3	33	0.208333	0.291667	false
ecoli	lcl|U00096.3_cds_ACO60007.1_2865	ATGATGCGACTTGTCATCATACTGATTGTACTGTTACTCATAAGTTTCAGCGCTTATTAA	ATG ATG CGA CTT GTC ATC ATA CTG ATT GTA CTG TTA CTC ATA AGT TTC AGC GCT TAT	19	0.368421	0.236111	0.958333	0.214286	false	L2_short	drop_stop	balanced	mid_regularity	q2	33	0.208333	0.291667	false
ecoli	lcl|U00096.3_cds_ACO60008.1_3001	ATGATGAAGCTCGTCATCATACTGATTGTGTTGTTACTCGTAAGTTTCGCAGCTTATTAA	ATG ATG AAG CTC GTC ATC ATA CTG ATT GTG TTG TTA CTC GTA AGT TTC GCA GCT TAT	19	0.385965	0.236111	0.958333	0.436508	false	L2_short	drop_stop	balanced	mid_regularity	q2	33	0.208333	0.291667	false
ecoli	lcl|U00096.3_cds_ACO60009.1_3002	ATGATGAAGCTCGTCATCATACTGGTTGTGTTGTTACTGTTAAGTTTCCCGACTTACTAA	ATG ATG AAG CTC GTC ATC ATA CTG GTT GTG TTG TTA CTG TTA AGT TTC CCG ACT TAC	19	0.403509	0.277778	0.916667	0.333333	false	L2_short	drop_stop	balanced	mid_regularity	q3	33	0.208333	0.291667	false
ecoli	lcl|U00096.3_cds_ACO60011.1_3710	ATGAATAACAGCACAAAATTCTGTTTCTCAAGATTCAGGACGGGGAACTAA	ATG AAT AAC AGC ACA AAA TTC TGT TTC TCA AGA TTC AGG ACG GGG AAC	16	0.395833	0.187500	0.937500	0.214286	false	L2_short	drop_stop	balanced	low_regularity	q1	33	0.208333	0.291667	false
ecoli	lcl|U00096.3_cds_ACO60013.1_4086	ATGCGTTTTTATTTTTATTCACAAGCTGTGGATGAATCAGGCGTCACGCGGTAA	ATG CGT TTT TAT TTT TAT TCA CAA GCT GTG GAT GAA TCA GGC GTC ACG CGG	17	0.431373	0.458333	0.916667	0.111111	false	L2_short	drop_stop	balanced	high_regularity	q4	33	0.208333	0.291667	false
ecoli	lcl|U00096.3_cds_ADO17949.1_4159	ATGGAACCTGATCCCACGCCTCTCCCTCGACGGAGATTAAAACTTTTCCGGTAA	ATG GAA CCT GAT CCC ACG CCT CTC CCT CGA CGG AGA TTA AAA CTT TTC CGG	17	0.529412	0.458333	0.958333	0.103175	false	L2_short	drop_stop	balanced	high_regularity	q4	33	0.208333	0.291667	false
ecoli	lcl|U00096.3_cds_AYC08165.1_104	ATGATTATCAAAACGTTAAAAATGAGTGCACGAAAGCGAAATTGA	ATG ATT ATC AAA ACG TTA AAA ATG AGT GCA CGA AAG CGA AAT	14	0.309524	0.291667	0.791667	0.000000	false	L2_short	drop_stop	balanced	high_regularity	q3	33	0.208333	0.291667	false
ecoli	lcl|U00096.3_cds_AYC08194.1_1134	ATGTTTAGCAAATTGGCACAAAGTAGCATAAAGGCTATGTTTTAA	ATG TTT AGC AAA TTG GCA CAA AGT AGC ATA AAG GCT ATG TTT	14	0.333333	0.145833	1.000000	0.171429	false	L2_short	drop_stop	balanced	low_regularity	q1	33	0.208333	0.291667	false
ecoli	lcl|U00096.3_cds_AYC08211.1_1477	ATGGTGCAGTTAGTCGATCTCGCACGTTGCGTTTCATTTTGA	ATG GTG CAG TTA GTC GAT CTC GCA CGT TGC GTT TCA TTT	13	0.461538	0.162500	1.000000	0.071429	false	L2_short	drop_stop	balanced	low_regularity	q1	33	0.208333	0.291667	false
ecoli	lcl|U00096.3_cds_QNV50518.1_156	ATGGAACGTGCGAGTAAAATGCCGTCATCTTATTTGTATGACCAATAA	ATG GAA CGT GCG AGT AAA ATG CCG TCA TCT TAT TTG TAT GAC CAA	15	0.400000	0.267857	0.866071	0.100000	false	L2_short	drop_stop	balanced	mid_regularity	q3	33	0.208333	0.291667	false
ecoli	lcl|U00096.3_cds_QNV50520.1_366	ATGATCGGTATCAACGTAGCCATCTTCACCAATGTTCAGCGAAGAACCGTTAGTTAA	ATG ATC GGT ATC AAC GTA GCC ATC TTC ACC AAT GTT CAG CGA AGA ACC GTT AGT	18	0.444444	0.375000	0.875000	0.133333	false	L2_short	drop_stop	balanced	high_regularity	q4	33	0.208333	0.291667	false
ecoli	lcl|U00096.3_cds_QNV50522.1_777	ATGCGTCTGTCGGCAAACAGACAGGGAAATACTTGTGCTGGACGTAGCGTAAACGCCTGA	ATG CGT CTG TCG GCA AAC AGA CAG GGA AAT ACT TGT GCT GGA CGT AGC GTA AAC GCC	19	0.526316	0.236111	0.958333	0.000000	false	L2_short	drop_stop	balanced	mid_regularity	q2	33	0.208333	0.291667	false
ecoli	lcl|U00096.3_cds_QNV50524.1_1218	ATGCTGTCAAAAGGCGTATTGTCAGCGCGTCTTTTCAACCTTATTTATGGCTAA	ATG CTG TCA AAA GGC GTA TTG TCA GCG CGT CTT TTC AAC CTT ATT TAT GGC	17	0.431373	0.500000	0.916667	0.111111	false	L2_short	drop_stop	balanced	high_regularity	q4	33	0.208333	0.291667	false
ecoli	lcl|U00096.3_cds_QNV50526.1_1329	ATGTTGCGTAACAGGGCCAGAAGGCTAGACTACAAAATAATGCGTTGA	ATG TTG CGT AAC AGG GCC AGA AGG CTA GAC TAC AAA ATA ATG CGT	15	0.444444	0.196429	0.937500	0.250000	false	L2_short	drop_stop	balanced	low_regularity	q1	33	0.208333	0.291667	false
ecoli	lcl|U00096.3_cds_QNV50531.1_1875	ATGTCCATTTTCAGAATACATTTAGATGGCAATAAAAAAGCCTGA	ATG TCC ATT TTC AGA ATA CAT TTA GAT GGC AAT AAA AAA GCC	14	0.309524	0.229167	0.916667	0.196429	false	L2_short	drop_stop	balanced	mid_regularity	q2	33	0.208333	0.291667	false
ecoli	lcl|U00096.3_cds_QNV50535.1_2568	ATGAACAGAGAAGAAATGCACTGTGATGTTGTCAAAATTTAA	ATG AAC AGA GAA GAA ATG CAC TGT GAT GTT GTC AAA ATT	13	0.333333	0.225000	0.875000	0.000000	false	L2_short	drop_stop	balanced	mid_regularity	q2	33	0.208333	0.291667	false
ecoli	lcl|U00096.3_cds_QNV50536.1_2572	ATGGAAGTGGGCAAGTTGGGGAAGCCGTATCCGTTGCTGAATCTGGCATATGTGGGAGTATAA	ATG GAA GTG GGC AAG TTG GGG AAG CCG TAT CCG TTG CTG AAT CTG GCA TAT GTG GGA GTA	20	0.516667	0.250000	0.875000	0.277778	false	L2_short	drop_stop	balanced	mid_regularity	q2	33	0.208333	0.291667	false
ecoli	lcl|U00096.3_cds_QNV50541.1_3368	ATGATTTACCGGGAGTTAAATAGAGCATTGGCTATTCTTTAA	ATG ATT TAC CGG GAG TTA AAT AGA GCA TTG GCT ATT CTT	13	0.358974	0.162500	1.000000	0.196429	false	L2_short	drop_stop	balanced	low_regularity	q1	33	0.208333	0.291667	false
ecoli	lcl|U00096.3_cds_QNV50545.1_3433	ATGGTGTTAAATGTTGTATTGGCTGGGGATTTTGATTGCGTACGCAGACCGTAG	ATG GTG TTA AAT GTT GTA TTG GCT GGG GAT TTT GAT TGC GTA CGC AGA CCG	17	0.450980	0.458333	0.958333	0.000000	false	L2_short	drop_stop	balanced	high_regularity	q4	33	0.208333	0.291667	false
ecoli	lcl|U00096.3_cds_QNV50551.1_3606	ATGACGTCGGATTACCGTGTGTCACCAATAAAAAAGTCCCGACCAGCGATGTCAAAATAG	ATG ACG TCG GAT TAC CGT GTG TCA CCA ATA AAA AAG TCC CGA CCA GCG ATG TCA AAA	19	0.456140	0.236111	0.958333	0.150794	false	L2_short	drop_stop	balanced	mid_regularity	q2	33	0.208333	0.291667	false
ecoli	lcl|U00096.3_cds_UMR55112.1_1154	ATGGCCTTTTCTGAACTCAACATTGACATTCTTACCCGCAGCAAAGCTCGTGGAGGTTAG	ATG GCC TTT TCT GAA CTC AAC ATT GAC ATT CTT ACC CGC AGC AAA GCT CGT GGA GGT	19	0.473684	0.194444	1.000000	0.166667	false	L2_short	drop_stop	balanced	low_regularity	q1	33	0.208333	0.291667	false
ecoli	lcl|U00096.3_cds_UMR55114.1_1990	ATGATAGTGAAAAGGGATAAAAGCATTGTCATCTGCGGCAGCTATGAGTAA	ATG ATA GTG AAA AGG GAT AAA AGC ATT GTC ATC TGC GGC AGC TAT GAG	16	0.416667	0.187500	0.937500	0.297619	false	L2_short	drop_stop	balanced	low_regularity	q1	33	0.208333	0.291667	false
ecoli	lcl|U00096.3_cds_UMR55117.1_3297	ATGAGATGGCAATTGAACAAACAGCAATTACACGCGCGACTTTCGATGAAGTGA	ATG AGA TGG CAA TTG AAC AAA CAG CAA TTA CAC GCG CGA CTT TCG ATG AAG	17	0.431373	0.416667	1.000000	0.142857	false	L2_short	drop_stop	balanced	high_regularity	q4	33	0.208333	0.291667	false
ecoli	lcl|U00096.3_cds_UMR55118.1_3989	ATGCACTTACAATTGATTAAAGACAACATTCACAGTGTGGTTATTTGTTACACATAG	ATG CAC TTA CAA TTG ATT AAA GAC AAC ATT CAC AGT GTG GTT ATT TGT TAC ACA	18	0.314815	0.291667	0.958333	0.158730	false	L2_short	drop_stop	balanced	high_regularity	q3	33	0.208333	0.291667	false
ecoli	lcl|U00096.3_cds_XJW14021.1_3795	ATGTTCTATCTTTCAGACCTTTTACTTCACGTAATCGGATTTGGCTGA	ATG TTC TAT CTT TCA GAC CTT TTA CTT CAC GTA ATC GGA TTT GGC	15	0.377778	0.196429	0.937500	0.000000	false	L2_short	drop_stop	balanced	low_regularity	q1	33	0.208333	0.291667	false
human	lcl|NC_000001.11_cds_NP_001401871.1_5760	ATGAAGACAAACACAGAGATGGTGTGTCTAAGAAACTTCAAAAGGTGTAGACCTCCTGACTGA	ATG AAG ACA AAC ACA GAG ATG GTG TGT CTA AGA AAC TTC AAA AGG TGT AGA CCT CCT GAC	20	0.416667	0.333333	0.791667	0.000000	false	L2_short	drop_stop	balanced	mid_regularity	q2	3	0.279166	0.354166	false
human	lcl|NC_000007.14_cds_NP_001401827.1_53865	ATGCCTCCGCCTCGTTGCCCTGAAAGCCGCAGCGACAGCGAAAAGGGCTAA	ATG CCT CCG CCT CGT TGC CCT GAA AGC CGC AGC GAC AGC GAA AAG GGC	16	0.645833	0.375000	0.750000	0.400000	false	L2_short	drop_stop	balanced	high_regularity	q4	3	0.279166	0.354166	false
human	lcl|NC_000016.10_cds_NP_001404532.1_102380	ATGGAATCGCAGACGGTTGATGATGAAGCGCCGGCCGTGTAA	ATG GAA TCG CAG ACG GTT GAT GAT GAA GCG CCG GCC GTG	13	0.589744	0.225000	0.937500	0.291667	false	L2_short	drop_stop	balanced	low_regularity	q1	3	0.279166	0.354166	false
scerevisiae	lcl|BK006943.2_cds_DAA08936.1_3269	ATGCTATCGTTAATCTTTTACCTTCGTTTCCCATCTTATATAAGGGGATGA	ATG CTA TCG TTA ATC TTT TAC CTT CGT TTC CCA TCT TAT ATA AGG GGA	16	0.354167	0.125000	1.000000	0.071429	false	L2_short	drop_stop	balanced	low_regularity	q1	1	0.125000	0.125000	false
