species	seq_id	cds_nt	codon_tokens	num_codons	gc_content	dominant_reference_coverage	avg_window_heterogeneity	sparse_difference_ratio	has_internal_stop	length_group	terminal_stop_policy	sampling_view	regularity_group	regularity_quartile	regularity_bin_n	regularity_q1	regularity_q3	regularity_is_reportable
human	lcl|NC_000008.11_cds_XP_047277733.1_56896	ATGGCCAAGAACAAATTAAGAGGGCCGAAGTCCAGGAATGTATTTCACATAGCCAGCCAAAAAAACTTTAAGGCTAAAAACAAAGCAAAACCAGTTACCACTAATCTTAAGAAGATTCCTCAGCAGCGTCATGAAAGCAAACCAGTTAATGTTGATGAAGCTACAAGATTAATGGCTCTGTTGTAA	ATG GCC AAG AAC AAA TTA AGA GGG CCG AAG TCC AGG AAT GTA TTT CAC ATA GCC AGC CAA AAA AAC TTT AAG GCT AAA AAC AAA GCA AAA CCA GTT ACC ACT AAT CTT AAG AAG ATT CCT CAG CAG CGT CAT GAA AGC AAA CCA GTT AAT GTT GAT GAA GCT ACA AGA TTA ATG GCT CTG TTG	61	0.387978	0.212500	0.921875	0.331548	false	L1_short	drop_stop	balanced	mid_regularity	q2	150	0.202778	0.265191	true
human	lcl|NC_000009.12_cds_NP_001341574.1_62670	ATGGGGTCCAAGATCTTCTGTTGTTGCCGCAAGACCAGCGAGGGGTCTTCCACCACTGTTGGCTTCCACAATCCAAGAATGTTCGAACAGCATCATCCACGGTCCTTCAATCTGAACACAAATTCTCTCCACAGTGCTGTACCAAAAAGACATCCACGCCTCCCCTATGACAACCGCATGATGCTCAAGGCGTGCATCCTTAGGAGGCCATGA	ATG GGG TCC AAG ATC TTC TGT TGT TGC CGC AAG ACC AGC GAG GGG TCT TCC ACC ACT GTT GGC TTC CAC AAT CCA AGA ATG TTC GAA CAG CAT CAT CCA CGG TCC TTC AAT CTG AAC ACA AAT TCT CTC CAC AGT GCT GTA CCA AAA AGA CAT CCA CGC CTC CCC TAT GAC AAC CGC ATG ATG CTC AAG GCG TGC ATC CTT AGG AGG CCA	70	0.514286	0.189815	0.939815	0.116402	false	L1_short	drop_stop	balanced	low_regularity	q1	150	0.202778	0.265191	true
human	lcl|NC_000009.12_cds_NP_001365366.1_63401	ATGCCATTCATCGACAGTCAGCATGTCATCCACAAGTATTTCCTGCCCCGAGCCTATGCTGTCGCCATCCCACTGGCTGCAGGCCTCCTGCTGCTCCTGTTTGTGGGACTGTTCATCTCCTATGTGATGCTGAAGACCAAGAGAGTGACCAAGAAGGCTCAGTGA	ATG CCA TTC ATC GAC AGT CAG CAT GTC ATC CAC AAG TAT TTC CTG CCC CGA GCC TAT GCT GTC GCC ATC CCA CTG GCT GCA GGC CTC CTG CTG CTC CTG TTT GTG GGA CTG TTC ATC TCC TAT GTG ATG CTG AAG ACC AAG AGA GTG ACC AAG AAG GCT CAG	54	0.537037	0.244048	0.869048	0.188095	false	L1_short	drop_stop	balanced	mid_regularity	q3	150	0.202778	0.265191	true
human	lcl|NC_000010.11_cds_NP_001035824.1_66694	ATGTGGACAGCCAGAGGCCCCTTCAGAAGAGACAGGTGGAGCAGTGAGGATGAGGAGGCTGCAGGGCCATCACAGGCTCTCTCCCCTCTACTTTCTGTTCAACATCATGGATATAGTGGCCCAAATGAGAGAACAACGTTCTGGCATGGTTCAAACGAAGGAGCAGTATCACTTTTGTTACGATATTGTGCTTGA	ATG TGG ACA GCC AGA GGC CCC TTC AGA AGA GAC AGG TGG AGC AGT GAG GAT GAG GAG GCT GCA GGG CCA TCA CAG GCT CTC TCC CCT CTA CTT TCT GTT CAA CAT CAT GGA TAT AGT GGC CCA AAT GAG AGA ACA ACG TTC TGG CAT GGT TCA AAC GAA GGA GCA GTA TCA CTT TTG TTA CGA TAT TGT GCT	64	0.500000	0.171875	0.953125	0.163690	false	L1_short	drop_stop	balanced	low_regularity	q1	150	0.202778	0.265191	true
human	lcl|NC_000010.11_cds_NP_001127906.1_67569	ATGCGCGCCCCGGGCTGCGGGCGGCTGGTGCTGCCGCTGCTGCTCCTGGCCGCGGCAGCCCTGGCCGAAGGCGACGCCAAGGGGCTCAAGGAGGGCGAGACCCCCGGCAATTTCATGGAGGACGAGCAATGGCTGTCGTCCATCTCGCAGTACAGCGGCAAGATCAAGCACTGGAACCGCTTCCGAGACGTTCCCTCGTCCGACCCACCCAGTACAACGCAGGCCACACCATGA	ATG CGC GCC CCG GGC TGC GGG CGG CTG GTG CTG CCG CTG CTG CTC CTG GCC GCG GCA GCC CTG GCC GAA GGC GAC GCC AAG GGG CTC AAG GAG GGC GAG ACC CCC GGC AAT TTC ATG GAG GAC GAG CAA TGG CTG TCG TCC ATC TCG CAG TAC AGC GGC AAG ATC AAG CAC TGG AAC CGC TTC CGA GAC GTT CCC TCG TCC GAC CCA CCC AGT ACA ACG CAG GCC ACA CCA	77	0.675325	0.257500	0.875000	0.305238	false	L1_short	drop_stop	balanced	mid_regularity	q3	150	0.202778	0.265191	true
human	lcl|NC_000010.11_cds_NP_001276726.1_67540	ATGACAAGAGTGGCCCTGCAGGCTGAGAAACTGGACCACCATCCTGAATGGTTTAACGTGTACAACAAGGTCCACATCACGCTGAGCACCCATGAGTGTGCCGGCCTTTCAGAACGGGACATAAACCTGGCCAGCTTCATCGAACAAGTAGCAGTGTCCATGACATAG	ATG ACA AGA GTG GCC CTG CAG GCT GAG AAA CTG GAC CAC CAT CCT GAA TGG TTT AAC GTG TAC AAC AAG GTC CAC ATC ACG CTG AGC ACC CAT GAG TGT GCC GGC CTT TCA GAA CGG GAC ATA AAC CTG GCC AGC TTC ATC GAA CAA GTA GCA GTG TCC ATG ACA	55	0.521212	0.145408	0.982143	0.214286	false	L1_short	drop_stop	balanced	low_regularity	q1	150	0.202778	0.265191	true
human	lcl|NC_000010.11_cds_NP_001339483.1_66718	ATGGTTGTTCACTGCAGTGCCGGCATAGGCCGGACAGGGGTGTTCCTATGTGTGGATGTCGTGTTCTGTGCCATCGTAAAGAACTGTTCATTCAACATCATGGATATAGTGGCCCAAATGAGAGAACAACGTTCTGGCATGGTTCAAACGAAGGAGCAGTATCACTTTTGTTACGATATTGTGCTTGAAGTTCTTCGGAAACTTCTGACTTTGGATTAA	ATG GTT GTT CAC TGC AGT GCC GGC ATA GGC CGG ACA GGG GTG TTC CTA TGT GTG GAT GTC GTG TTC TGT GCC ATC GTA AAG AAC TGT TCA TTC AAC ATC ATG GAT ATA GTG GCC CAA ATG AGA GAA CAA CGT TCT GGC ATG GTT CAA ACG AAG GAG CAG TAT CAC TTT TGT TAC GAT ATT GTG CTT GAA GTT CTT CGG AAA CTT CTG ACT TTG GAT	72	0.453704	0.194444	0.916667	0.224868	false	L1_short	drop_stop	balanced	low_regularity	q1	150	0.202778	0.265191	true
human	lcl|NC_000010.11_cds_NP_006820.1_68265	ATGGCAAGCAAGGGCTTGCAGGACCTGAAGCAACAGGTGGAGGGGACCGCCCAGGAAGCCGTGTCAGCGGCCGGAGCGGCAGCTCAGCAAGTGGTGGACCAGGCCACAGAGGCGGGGCAGAAAGCCATGGACCAGCTGGCCAAGACCACCCAGGAAACCATCGACAAGACTGCTAACCAGGCCTCTGACACCTTCTCTGGGATTGGGAAAAAATTCGGCCTCCTGAAATGA	ATG GCA AGC AAG GGC TTG CAG GAC CTG AAG CAA CAG GTG GAG GGG ACC GCC CAG GAA GCC GTG TCA GCG GCC GGA GCG GCA GCT CAG CAA GTG GTG GAC CAG GCC ACA GAG GCG GGG CAG AAA GCC ATG GAC CAG CTG GCC AAG ACC ACC CAG GAA ACC ATC GAC AAG ACT GCT AAC CAG GCC TCT GAC ACC TTC TCT GGG ATT GGG AAA AAA TTC GGC CTC CTG AAA	76	0.605263	0.237500	0.875000	0.175714	false	L1_short	drop_stop	balanced	mid_regularity	q3	150	0.202778	0.265191	true
human	lcl|NC_000010.11_cds_XP_047281739.1_68092	ATGCGTGGAAAACCCCAGCAGCGGAGTGAGACCCTGTCAAAAAAAAAAGAAAGAAAGAAAATAGAAGCCAAGAATGGAGACCCAAATGACTGTTCAGAGTTTCTTCGTGGGTTGTCTTCTGGCCTCAGAGTATCCCTTATCAGAACCTTGGGCCCCTGGGCCCCTTCACTCAGTACTTGGTGGACCACCATCACACCCTCCTGTGCAATGGGTATTGGCTTGCCTGGCTGA	ATG CGT GGA AAA CCC CAG CAG CGG AGT GAG ACC CTG TCA AAA AAA AAA GAA AGA AAG AAA ATA GAA GCC AAG AAT GGA GAC CCA AAT GAC TGT TCA GAG TTT CTT CGT GGG TTG TCT TCT GGC CTC AGA GTA TCC CTT ATC AGA ACC TTG GGC CCC TGG GCC CCT TCA CTC AGT ACT TGG TGG ACC ACC ATC ACA CCC TCC TGT GCA ATG GGT ATT GGC TTG CCT GGC	76	0.504386	0.262500	0.837500	0.126190	false	L1_short	drop_stop	balanced	mid_regularity	q3	150	0.202778	0.265191	true
human	lcl|NC_000010.11_cds_XP_047281961.1_69824	ATGGCAGAAGTGAAGTCAATGTTCCGGGAAGTTCTTCCAAAGCAAGGGCCACTGTTTGTGGAAGATATAATGACAATGGTGCTGTGTAAACCCAAACTTTTACCCTTAAAATCTCTGACTCTGGAAAAACTAGAGAAAATGCATCAAGCAGCACAGAATACAATTCGCCAACAAGAAATGGCAGAAAAGGATCAACGGCAAATAACCCACTGA	ATG GCA GAA GTG AAG TCA ATG TTC CGG GAA GTT CTT CCA AAG CAA GGG CCA CTG TTT GTG GAA GAT ATA ATG ACA ATG GTG CTG TGT AAA CCC AAA CTT TTA CCC TTA AAA TCT CTG ACT CTG GAA AAA CTA GAG AAA ATG CAT CAA GCA GCA CAG AAT ACA ATT CGC CAA CAA GAA ATG GCA GAA AAG GAT CAA CGG CAA ATA ACC CAC	70	0.414286	0.231481	0.884259	0.173280	false	L1_short	drop_stop	balanced	mid_regularity	q3	150	0.202778	0.265191	true
human	lcl|NC_000011.10_cds_NP_001119653.1_78461	ATGGACTGCTGCACCGAGAACGCCTGCTCCAAGCCGGACGACGACATTCTAGACATCCCGCTGGACGATCCCGGCGCCAACGCGGCCGCCGCCAAAATCCAGGCGAGTTTTCGGGGCCACATGGCGCGGAAGAAGATAAAGAGCGGAGAGCGCGGCCGGAAGGGCCCGGGCCCTGGGGGGCCTGGCGGAGCTGGGGTGGCCCGGGGAGGCGCGGGCGGCGGCCCCAGCGGAGACTAG	ATG GAC TGC TGC ACC GAG AAC GCC TGC TCC AAG CCG GAC GAC GAC ATT CTA GAC ATC CCG CTG GAC GAT CCC GGC GCC AAC GCG GCC GCC GCC AAA ATC CAG GCG AGT TTT CGG GGC CAC ATG GCG CGG AAG AAG ATA AAG AGC GGA GAG CGC GGC CGG AAG GGC CCG GGC CCT GGG GGG CCT GGC GGA GCT GGG GTG GCC CGG GGA GGC GCG GGC GGC GGC CCC AGC GGA GAC	78	0.713675	0.295833	0.808333	0.261667	false	L1_short	drop_stop	balanced	high_regularity	q4	150	0.202778	0.265191	true
human	lcl|NC_000011.10_cds_NP_001263182.2_71116	ATGGCGGCCCCGCGGCGAGGGAGAGGATCCTCCACAGTGCTCTCTTCAGTTCCCCTTCAAATGCTGTTTTATCTCAGCGGAACGTACTACGCCCTGTATTTCCTCGCCACCTCTGCCTCACAGGCAGGCAGGCCCGGTGCAAGAGTGGACTCTGGGTTCCTAAAGCAATAA	ATG GCG GCC CCG CGG CGA GGG AGA GGA TCC TCC ACA GTG CTC TCT TCA GTT CCC CTT CAA ATG CTG TTT TAT CTC AGC GGA ACG TAC TAC GCC CTG TAT TTC CTC GCC ACC TCT GCC TCA CAG GCA GGC AGG CCC GGT GCA AGA GTG GAC TCT GGG TTC CTA AAG CAA	56	0.583333	0.196429	0.928571	0.112245	false	L1_short	drop_stop	balanced	low_regularity	q1	150	0.202778	0.265191	true
human	lcl|NC_000011.10_cds_NP_001307269.1_72741	ATGGAATTCGGCGCGAAAAGACATTGCTTTCTCCGGGAGCTCTTTAGTCGTCTAGGAGATGAAGAGAAAAGAGCAAAGCTTGCAGAGGCTGCAGAGAGAAGACAAAAAGAGGCTGCATCTCGGGGAATTTTAGATGTTCAATCTGTGCAAGAAAAGAGAAAGAAAAAGGAAAAAATAGAAAAACAAATTGCTACATCCGGGCCCCCACCAGAAGGTGGACTTAGGTGGACAGTTTCATAA	ATG GAA TTC GGC GCG AAA AGA CAT TGC TTT CTC CGG GAG CTC TTT AGT CGT CTA GGA GAT GAA GAG AAA AGA GCA AAG CTT GCA GAG GCT GCA GAG AGA AGA CAA AAA GAG GCT GCA TCT CGG GGA ATT TTA GAT GTT CAA TCT GTG CAA GAA AAG AGA AAG AAA AAG GAA AAA ATA GAA AAA CAA ATT GCT ACA TCC GGG CCC CCA CCA GAA GGT GGA CTT AGG TGG ACA GTT TCA	79	0.443038	0.226786	0.862500	0.244762	false	L1_short	drop_stop	balanced	mid_regularity	q2	150	0.202778	0.265191	true
human	lcl|NC_000011.10_cds_NP_001307270.1_72738	ATGGGGCTGTGTTTTCCTTGTCCCGGGGAGTCCGCGCCTCCCACGCCGGACCTGGAAGAGAAAAGAGCAAAGCTTGCAGAGGCTGCAGAGAGAAGACAAAAAGAGGCTGCATCTCGGGGAATTTTAGATGTTCAATCTGTGCAAGAAAAGAGAAAGAAAAAGGAAAAAATAGAAAAACAAATTGCTACATCCGGGCCCCCACCAGAAGGTGGACTTAGGGAAAATGGACATGAACTTTGA	ATG GGG CTG TGT TTT CCT TGT CCC GGG GAG TCC GCG CCT CCC ACG CCG GAC CTG GAA GAG AAA AGA GCA AAG CTT GCA GAG GCT GCA GAG AGA AGA CAA AAA GAG GCT GCA TCT CGG GGA ATT TTA GAT GTT CAA TCT GTG CAA GAA AAG AGA AAG AAA AAG GAA AAA ATA GAA AAA CAA ATT GCT ACA TCC GGG CCC CCA CCA GAA GGT GGA CTT AGG GAA AAT GGA CAT GAA CTT	79	0.481013	0.216071	0.860714	0.236190	false	L1_short	drop_stop	balanced	mid_regularity	q2	150	0.202778	0.265191	true
human	lcl|NC_000011.10_cds_NP_001671.2_77911	ATGACTGGGTTGTCGATGGACGGTGGCGGCAGCCCCAAGGGGGACGTGGACCCGTTCTACTATGACTATGAGACCGTTCGCAATGGGGGCCTGATCTTCGCTGGACTGGCCTTCATCGTGGGGCTCCTCATCCTCCTCAGCAGAAGATTCCGCTGTGGGGGCAATAAGAAGCGCAGGCAAATCAATGAAGATGAGCCGTAA	ATG ACT GGG TTG TCG ATG GAC GGT GGC GGC AGC CCC AAG GGG GAC GTG GAC CCG TTC TAC TAT GAC TAT GAG ACC GTT CGC AAT GGG GGC CTG ATC TTC GCT GGA CTG GCC TTC ATC GTG GGG CTC CTC ATC CTC CTC AGC AGA AGA TTC CGC TGT GGG GGC AAT AAG AAG CGC AGG CAA ATC AAT GAA GAT GAG CCG	66	0.580808	0.263889	0.888889	0.205026	false	L1_short	drop_stop	balanced	mid_regularity	q3	150	0.202778	0.265191	true
human	lcl|NC_000011.10_cds_NP_055021.1_74402	ATGGAGCTCGAGGCCATGAGCAGATATACCAGCCCAGTGAACCCAGCTGTCTTCCCCCATCTGACCGTGGTGCTTTTGGCCATTGGCATGTTCTTCACCGCCTGGTTCTTCGTTTACGAGGTCACCTCTACCAAGTACACTCGTGATATCTATAAAGAGCTCCTCATCTCCTTAGTGGCCTCACTCTTCATGGGCTTTGGAGTCCTCTTCCTGCTGCTCTGGGTTGGCATCTACGTGTGA	ATG GAG CTC GAG GCC ATG AGC AGA TAT ACC AGC CCA GTG AAC CCA GCT GTC TTC CCC CAT CTG ACC GTG GTG CTT TTG GCC ATT GGC ATG TTC TTC ACC GCC TGG TTC TTC GTT TAC GAG GTC ACC TCT ACC AAG TAC ACT CGT GAT ATC TAT AAA GAG CTC CTC ATC TCC TTA GTG GCC TCA CTC TTC ATG GGC TTT GGA GTC CTC TTC CTG CTG CTC TGG GTT GGC ATC TAC GTG	79	0.527426	0.226786	0.875000	0.164286	false	L1_short	drop_stop	balanced	mid_regularity	q2	150	0.202778	0.265191	true
human	lcl|NC_000011.10_cds_NP_066951.1_71228	ATGATCATCCCTGTACGCTGCTTCACTTGTGGCAAGATCGTCGGCAACAAGTGGGAGGCTTACCTGGGGCTGCTGCAGGCCGAGTACACCGAGGGGGATGCGCTGGATGCCCTGGGCCTGAAGCGCTACTGCTGCCGCCGGATGCTGCTGGCCCACGTGGACCTGATCGAGAAGCTGCTCAATTATGCACCCCTGGAGAAGTGA	ATG ATC ATC CCT GTA CGC TGC TTC ACT TGT GGC AAG ATC GTC GGC AAC AAG TGG GAG GCT TAC CTG GGG CTG CTG CAG GCC GAG TAC ACC GAG GGG GAT GCG CTG GAT GCC CTG GGC CTG AAG CGC TAC TGC TGC CGC CGG ATG CTG CTG GCC CAC GTG GAC CTG ATC GAG AAG CTG CTC AAT TAT GCA CCC CTG GAG AAG	67	0.611940	0.273148	0.847222	0.257672	false	L1_short	drop_stop	balanced	high_regularity	q4	150	0.202778	0.265191	true
human	lcl|NC_000012.12_cds_NP_001354295.1_80093	ATGAGCGATCCCTCTCAACTGACTCAAAATGTTTGCCTCACCCAGGAGGGCTCCCTATGCCTCTCCTTTTTTCCTTTCATCTGCATTATTCCCGTTGCCAAAATCTGGAGCCTGGTAAAGGCCCAGTAG	ATG AGC GAT CCC TCT CAA CTG ACT CAA AAT GTT TGC CTC ACC CAG GAG GGC TCC CTA TGC CTC TCC TTT TTT CCT TTC ATC TGC ATT ATT CCC GTT GCC AAA ATC TGG AGC CTG GTA AAG GCC CAG	42	0.500000	0.229167	0.937500	0.130952	false	L1_short	drop_stop	balanced	mid_regularity	q2	150	0.202778	0.265191	true
human	lcl|NC_000012.12_cds_NP_001381138.1_84122	ATGAGTTTACCCCTCAATCCCAAACCTTTCCTCAATGGACTAACAGGAAAGCCAGTGATGGTGAAACTTAAGTGGGGAATGGAGTACAAGGGCTATCTGGTATCTGTAGATGGCTACATGAACATGCAGGTGTAA	ATG AGT TTA CCC CTC AAT CCC AAA CCT TTC CTC AAT GGA CTA ACA GGA AAG CCA GTG ATG GTG AAA CTT AAG TGG GGA ATG GAG TAC AAG GGC TAT CTG GTA TCT GTA GAT GGC TAC ATG AAC ATG CAG GTG	44	0.454545	0.229167	0.895833	0.130952	false	L1_short	drop_stop	balanced	mid_regularity	q2	150	0.202778	0.265191	true
human	lcl|NC_000012.12_cds_NP_001401300.1_80207	ATGGTTGACCTCACCCAGGTAATGGATGATGAAGTATTCATGGCTTTTGCATCCTATGCAACAATTATTCTTTCAAAAATGATGCTTATGAGTACTGCAACTGCATTCTATAGATTGACAAGAAAGGTTTTTGCCAATCCAGAAGACTGTGTAGCATTTGGCAAAGGAGAAAATGCCAAGAAGTATCTTCGAACAGATGACAGAGTAGAACGTGTACGCAGGTAA	ATG GTT GAC CTC ACC CAG GTA ATG GAT GAT GAA GTA TTC ATG GCT TTT GCA TCC TAT GCA ACA ATT ATT CTT TCA AAA ATG ATG CTT ATG AGT ACT GCA ACT GCA TTC TAT AGA TTG ACA AGA AAG GTT TTT GCC AAT CCA GAA GAC TGT GTA GCA TTT GGC AAA GGA GAA AAT GCC AAG AAG TAT CTT CGA ACA GAT GAC AGA GTA GAA CGT GTA CGC AGG	74	0.396396	0.262500	0.887500	0.114286	false	L1_short	drop_stop	balanced	mid_regularity	q3	150	0.202778	0.265191	true
human	lcl|NC_000012.12_cds_NP_001401927.1_85649	ATGCCGGCCTCGTCCACCGTCCACGTGCTGCAGCTGCTGCGGGAGCTGCTCGCCTTCGTGCTCCTCAGCTACACGGTGCTCATCGGGGCGCTGCTGCTGGCCGGCTGGACCACTTACTTCCTGGTGCTGAAGTGA	ATG CCG GCC TCG TCC ACC GTC CAC GTG CTG CAG CTG CTG CGG GAG CTG CTC GCC TTC GTG CTC CTC AGC TAC ACG GTG CTC ATC GGG GCG CTG CTG CTG GCC GGC TGG ACC ACT TAC TTC CTG GTG CTG AAG	44	0.666667	0.312500	0.833333	0.392460	false	L1_short	drop_stop	balanced	high_regularity	q4	150	0.202778	0.265191	true
human	lcl|NC_000012.12_cds_NP_001428743.1_79851	ATGTGCAATAATATTATCCTTCTGGTAATAGTAATTGTACTGAATATTTTGGTTTCTTTCAACTTTTCTACTGTCCATAAATCATGTCCTGCCAAAGACTGGAAGGTGCATAAGGGAAAATGTTACTGGATTGCTGAAACTAAGAAATCTTGGAACAAAAGTCAAAATGACTGTGCCATAAACAATTCATATCTCATGGTGATTCAAGACATTACTGCTATGAAATCCAATCTTTTTTGA	ATG TGC AAT AAT ATT ATC CTT CTG GTA ATA GTA ATT GTA CTG AAT ATT TTG GTT TCT TTC AAC TTT TCT ACT GTC CAT AAA TCA TGT CCT GCC AAA GAC TGG AAG GTG CAT AAG GGA AAA TGT TAC TGG ATT GCT GAA ACT AAG AAA TCT TGG AAC AAA AGT CAA AAT GAC TGT GCC ATA AAC AAT TCA TAT CTC ATG GTG ATT CAA GAC ATT ACT GCT ATG AAA TCC AAT CTT TTT	79	0.329114	0.226786	0.887500	0.215238	false	L1_short	drop_stop	balanced	mid_regularity	q2	150	0.202778	0.265191	true
human	lcl|NC_000012.12_cds_NP_598014.1_83939	ATGAAGGCCACTATCATCCTCCTTCTGCTTGCACAAGTTTCCTGGGCTGGACCGTTTCAACAGAGAGGCTTATTTGACTTTATGCTAGAAGATGAGGCTTCTGGGATAGGCCCAGAAGTTCCTGATGACCGCGACTTCGAGCCCTCCCTAGGCCCAGTGTGCCCCTTCCGCTGTCAATGCCATCTTCGAGTGGTCCAGTGTTCTGATTTGGGTTGTCTACCTTCATAA	ATG AAG GCC ACT ATC ATC CTC CTT CTG CTT GCA CAA GTT TCC TGG GCT GGA CCG TTT CAA CAG AGA GGC TTA TTT GAC TTT ATG CTA GAA GAT GAG GCT TCT GGG ATA GGC CCA GAA GTT CCT GAT GAC CGC GAC TTC GAG CCC TCC CTA GGC CCA GTG TGC CCC TTC CGC TGT CAA TGC CAT CTT CGA GTG GTC CAG TGT TCT GAT TTG GGT TGT CTA CCT TCA	75	0.520000	0.195833	0.950000	0.171429	false	L1_short	drop_stop	balanced	low_regularity	q1	150	0.202778	0.265191	true
human	lcl|NC_000013.11_cds_NP_001182359.1_86922	ATGTTAGAACTCATAGAAGTTAATGGAACCCCTGGTAGTCAGCTCTCTACTCCGCGCTCAGGCAAGTCGCCAAGCCCATCACCCACCAGCCCAGGAAGCCTGCGGAAGCAGAGGGACCTGTACCGCCCCCTCTCTTCGGATGACTTGGATTCAGTAGGAGACTCAGTGTAA	ATG TTA GAA CTC ATA GAA GTT AAT GGA ACC CCT GGT AGT CAG CTC TCT ACT CCG CGC TCA GGC AAG TCG CCA AGC CCA TCA CCC ACC AGC CCA GGA AGC CTG CGG AAG CAG AGG GAC CTG TAC CGC CCC CTC TCT TCG GAT GAC TTG GAT TCA GTA GGA GAC TCA GTG	56	0.559524	0.196429	0.910714	0.112245	false	L1_short	drop_stop	balanced	low_regularity	q1	150	0.202778	0.265191	true
human	lcl|NC_000013.11_cds_NP_001273635.1_87061	ATGTCGAAGGTTTCCTTTAAGATCACGCTGACGTCGGACCCACGGCTGCCGTACAAAGTACTCAGTGTTCCTGAAAGTACACCTTTCACAGCAGTCTTAAAGTTTGCAGCAGAAGAATTTAAAGTTCCTGCTGCAACAAGTGCAATTATTACCAATGATGGAATAGGAATAAATCCTGCACAGACTGCTGGCCTTGCAGTTGAAATTCAGCCATAA	ATG TCG AAG GTT TCC TTT AAG ATC ACG CTG ACG TCG GAC CCA CGG CTG CCG TAC AAA GTA CTC AGT GTT CCT GAA AGT ACA CCT TTC ACA GCA GTC TTA AAG TTT GCA GCA GAA GAA TTT AAA GTT CCT GCT GCA ACA AGT GCA ATT ATT ACC AAT GAT GGA ATA GGA ATA AAT CCT GCA CAG ACT GCT GGC CTT GCA GTT GAA ATT CAG CCA	71	0.441315	0.210317	0.861111	0.219577	false	L1_short	drop_stop	balanced	mid_regularity	q2	150	0.202778	0.265191	true
human	lcl|NC_000013.11_cds_NP_001382153.1_86855	ATGCGTAGGGGTAGAGTAAGAATTCTGCTTGGTCAGAATCGTGATGGCATTGTGTTCAGCACTGATGACTATTTTCACCATCAAGATGGGTACAGGTATAATGTTAATCAACTTGGTGATGCCCATGACTGGAACCAGAACAGAGGAGGAATAAACATGGTGTGTCTCGAAAGAAGATTGCTCAGATGTTGGATCGTTATGAATATCAAATGTCCATTTCTATTGTAA	ATG CGT AGG GGT AGA GTA AGA ATT CTG CTT GGT CAG AAT CGT GAT GGC ATT GTG TTC AGC ACT GAT GAC TAT TTT CAC CAT CAA GAT GGG TAC AGG TAT AAT GTT AAT CAA CTT GGT GAT GCC CAT GAC TGG AAC CAG AAC AGA GGA GGA ATA AAC ATG GTG TGT CTC GAA AGA AGA TTG CTC AGA TGT TGG ATC GTT ATG AAT ATC AAA TGT CCA TTT CTA TTG	75	0.408889	0.233333	0.912500	0.126190	false	L1_short	drop_stop	balanced	mid_regularity	q3	150	0.202778	0.265191	true
human	lcl|NC_000014.9_cds_NP_001025172.1_89929	ATGGGTCACCAGCAGCTGTACTGGAGCCACCCGCGAAAATTCGGCCAGGGTTCTCGCTCTTGTCGTGTCTGTTCAAACCGGCACGGTCTGATCCGGAAATATGGCCTCAATATGTGCCGCCAGTGTTTCCGTCAGTACGCGAAGGATATCGGTTTCATTAAGAAAGACCTGAGCTGTCTTCCTTGGCACTGCCTATGGAGGTGA	ATG GGT CAC CAG CAG CTG TAC TGG AGC CAC CCG CGA AAA TTC GGC CAG GGT TCT CGC TCT TGT CGT GTC TGT TCA AAC CGG CAC GGT CTG ATC CGG AAA TAT GGC CTC AAT ATG TGC CGC CAG TGT TTC CGT CAG TAC GCG AAG GAT ATC GGT TTC ATT AAG AAA GAC CTG AGC TGT CTT CCT TGG CAC TGC CTA TGG AGG	67	0.537313	0.203704	0.930556	0.214286	false	L1_short	drop_stop	balanced	mid_regularity	q2	150	0.202778	0.265191	true
human	lcl|NC_000014.9_cds_NP_001275888.1_92071	ATGGCGGCTGTGCCCATGGTGCTCAGTGCCATGGGCTTCACTGCGGCGGGAATCGCCTCGTCCTCCATAGCAGCCAAGATGATGTCCGCGGCGGCCATTGCCAATGGGGGTGGAGTTGCCTCGGGCAGCCTTGTGGCTACTCTGCAGTCACTGGGAGCAACTGGACTCTCCGGATTGACCAAGTTCATCCTGGGCTCCATTGGGTCTGCCATTGCGGCTGTCATTGCGAGGTTCTACTAG	ATG GCG GCT GTG CCC ATG GTG CTC AGT GCC ATG GGC TTC ACT GCG GCG GGA ATC GCC TCG TCC TCC ATA GCA GCC AAG ATG ATG TCC GCG GCG GCC ATT GCC AAT GGG GGT GGA GTT GCC TCG GGC AGC CTT GTG GCT ACT CTG CAG TCA CTG GGA GCA ACT GGA CTC TCC GGA TTG ACC AAG TTC ATC CTG GGC TCC ATT GGG TCT GCC ATT GCG GCT GTC ATT GCG AGG TTC TAC	79	0.607595	0.214286	0.875000	0.130952	false	L1_short	drop_stop	balanced	mid_regularity	q2	150	0.202778	0.265191	true
human	lcl|NC_000014.9_cds_NP_001291419.1_90391	ATGGCTGCACAAATACCAGAATCTGATCAGATAAAACAGTTTAAGGAATTTCTGGGGACCTACAATAAACTTACAGAGACCTGCTTTTTGGACTGTGTTAAAGACTTCACAACAAGAGAAGTAAAACCTGAAGAGAATGAAGCCCTGGCAGCCAAAGCAGGACTCCTTGGCCAACCACGATAG	ATG GCT GCA CAA ATA CCA GAA TCT GAT CAG ATA AAA CAG TTT AAG GAA TTT CTG GGG ACC TAC AAT AAA CTT ACA GAG ACC TGC TTT TTG GAC TGT GTT AAA GAC TTC ACA ACA AGA GAA GTA AAA CCT GAA GAG AAT GAA GCC CTG GCA GCC AAA GCA GGA CTC CTT GGC CAA CCA CGA	60	0.427778	0.203125	0.937500	0.303571	false	L1_short	drop_stop	balanced	mid_regularity	q2	150	0.202778	0.265191	true
human	lcl|NC_000014.9_cds_NP_004885.1_92663	ATGCTTCAAAGTATTATTAAAAACATATGGATCCCCATGAAGCCCTACTACACCAAAGTTTACCAGGAGATTTGGATAGGAATGGGGCTGATGGGCTTCATCGTTTATAAAATCCGGGCTGCTGATAAAAGAAGTAAGGCTTTGAAAGCTTCAGCGCCTGCTCCTGGTCATCACTAA	ATG CTT CAA AGT ATT ATT AAA AAC ATA TGG ATC CCC ATG AAG CCC TAC TAC ACC AAA GTT TAC CAG GAG ATT TGG ATA GGA ATG GGG CTG ATG GGC TTC ATC GTT TAT AAA ATC CGG GCT GCT GAT AAA AGA AGT AAG GCT TTG AAA GCT TCA GCG CCT GCT CCT GGT CAT CAC	58	0.431034	0.281250	0.875000	0.312500	false	L1_short	drop_stop	balanced	high_regularity	q4	150	0.202778	0.265191	true
human	lcl|NC_000014.9_cds_NP_612145.2_89676	ATGGCGGGGATGGCGCTGGCGCGGGCCTGGAAGCAGATGTCCTGGTTCTACTACCAGTACCTGCTGGTCACGGCGCTCTACATGCTGGAGCCCTGGGAGCGGACGGTGTTCAATTCCATGCTGGTTTCCATTGTGGGGATGGCACTATACACAGGATACGTCTTCATGCCCCAGCACATCATGGCGATATTGCACTACTTTGAAATCGTACAATGA	ATG GCG GGG ATG GCG CTG GCG CGG GCC TGG AAG CAG ATG TCC TGG TTC TAC TAC CAG TAC CTG CTG GTC ACG GCG CTC TAC ATG CTG GAG CCC TGG GAG CGG ACG GTG TTC AAT TCC ATG CTG GTT TCC ATT GTG GGG ATG GCA CTA TAC ACA GGA TAC GTC TTC ATG CCC CAG CAC ATC ATG GCG ATA TTG CAC TAC TTT GAA ATC GTA CAA	71	0.553991	0.210317	0.888889	0.135979	false	L1_short	drop_stop	balanced	mid_regularity	q2	150	0.202778	0.265191	true
human	lcl|NC_000015.10_cds_NP_001025160.1_95303	ATGGTGCGGACTAAAGCAGACAGTGTTCCAGGCACTTACAGAAAAGTGGTGGCTGCTCGAGCCCCCAGAAAGGTGCTTGGTTCTTCCACCTCTGCCACTAATTCGACATCAGTTTCATCGAGGAAAGAGCATGTCCTTTGCAACCTGATCACACAAATGATGAAAAAGAATAGAACTTTCTCATTCATCTTTGAATAA	ATG GTG CGG ACT AAA GCA GAC AGT GTT CCA GGC ACT TAC AGA AAA GTG GTG GCT GCT CGA GCC CCC AGA AAG GTG CTT GGT TCT TCC ACC TCT GCC ACT AAT TCG ACA TCA GTT TCA TCG AGG AAA GAG CAT GTC CTT TGC AAC CTG ATC ACA CAA ATG ATG AAA AAG AAT AGA ACT TTC TCA TTC ATC TTT GAA	65	0.451282	0.291667	0.916667	0.216931	false	L1_short	drop_stop	balanced	high_regularity	q4	150	0.202778	0.265191	true
human	lcl|NC_000015.10_cds_NP_001186806.1_94328	ATGACCCGCGGTAACCAGCGTGAGCTCGCCCGCCAGAAGAATATGAAAAAGCAGAGCGACTCGGTTAAGGGAAAGCGCCGAGATGACGGGCTTTCTGCTGCCGCCCGCAAGCAGAGGGACTCGGAGATCATGCAGCAGAAGCAGAAAAAGGCAAACGAGAAGAAGGAGGAACCCAAGTAG	ATG ACC CGC GGT AAC CAG CGT GAG CTC GCC CGC CAG AAG AAT ATG AAA AAG CAG AGC GAC TCG GTT AAG GGA AAG CGC CGA GAT GAC GGG CTT TCT GCT GCC GCC CGC AAG CAG AGG GAC TCG GAG ATC ATG CAG CAG AAG CAG AAA AAG GCA AAC GAG AAG AAG GAG GAA CCC AAG	59	0.564972	0.244792	0.890625	0.266071	false	L1_short	drop_stop	balanced	mid_regularity	q3	150	0.202778	0.265191	true
human	lcl|NC_000015.10_cds_NP_001186807.1_94330	ATGAAAAAGCAGAGCGACTCGGTTAAGGGAAAGCGCCGAGATGACGGGCTTTCTGCTGCCGCCCGCAAGCAGAGGGACTCGGAGATCATGCAGCAGAAGCAGAAAAAGGCAAACGAGAAGAAGGAGGAACCCAAGTAG	ATG AAA AAG CAG AGC GAC TCG GTT AAG GGA AAG CGC CGA GAT GAC GGG CTT TCT GCT GCC GCC CGC AAG CAG AGG GAC TCG GAG ATC ATG CAG CAG AAG CAG AAA AAG GCA AAC GAG AAG AAG GAG GAA CCC AAG	45	0.548148	0.275000	0.862500	0.268254	false	L1_short	drop_stop	balanced	high_regularity	q4	150	0.202778	0.265191	true
human	lcl|NC_000015.10_cds_NP_001316542.1_95526	ATGCTGAGCCGGCTTCAGGAACTGCGCAAGGAGGAGGAGACGCTGCTGCGGTTGAAGGCAGCCCTGCACGACCAGCTGAACCGCCTCAAGATGTTGGTGCATGTAGACAATGAAGCATCAATCAACCAAACAACCCTGGAGCTGAGCACAAAGAGTCATGTGACGGAAGAGGAGGAGGAGGAAGAGGAAGAAGAATCAGATTCCTAA	ATG CTG AGC CGG CTT CAG GAA CTG CGC AAG GAG GAG GAG ACG CTG CTG CGG TTG AAG GCA GCC CTG CAC GAC CAG CTG AAC CGC CTC AAG ATG TTG GTG CAT GTA GAC AAT GAA GCA TCA ATC AAC CAA ACA ACC CTG GAG CTG AGC ACA AAG AGT CAT GTG ACG GAA GAG GAG GAG GAG GAA GAG GAA GAA GAA TCA GAT TCC	68	0.539216	0.250000	0.847222	0.292063	false	L1_short	drop_stop	balanced	mid_regularity	q3	150	0.202778	0.265191	true
human	lcl|NC_000015.10_cds_NP_001316543.1_95529	ATGATCAGTTCTAGAAGAGGGGATGAGATGCTGTCTTCTCACACTGTACCTGAACAGTCACATGATATGTTGGTGCATGTAGACAATGAAGCATCAATCAACCAAACAACCCTGGAGCTGAGCACAAAGAGTCATGTGACGGAAGAGGAGGAGGAGGAAGAGGAAGAAGAATCAGATTCCTAA	ATG ATC AGT TCT AGA AGA GGG GAT GAG ATG CTG TCT TCT CAC ACT GTA CCT GAA CAG TCA CAT GAT ATG TTG GTG CAT GTA GAC AAT GAA GCA TCA ATC AAC CAA ACA ACC CTG GAG CTG AGC ACA AAG AGT CAT GTG ACG GAA GAG GAG GAG GAG GAA GAG GAA GAA GAA TCA GAT TCC	60	0.455556	0.250000	0.859375	0.261905	false	L1_short	drop_stop	balanced	mid_regularity	q3	150	0.202778	0.265191	true
human	lcl|NC_000015.10_cds_NP_001339817.1_96424	ATGGAGGAGCCCACGCCCGAGCCCGTCTATGTCGACGTAGACAAAGGGCTGACCTTGGCCTGCTTCGTCTTCCTCTGCCTCTTCCTTGTCGTGATGATCATCCGCTGTGCCAAGGTCATCATGGACCCTTACAGCGCCATCCCCACATCCACCTGGGAGGAGCAGCACCTGGACGACTGA	ATG GAG GAG CCC ACG CCC GAG CCC GTC TAT GTC GAC GTA GAC AAA GGG CTG ACC TTG GCC TGC TTC GTC TTC CTC TGC CTC TTC CTT GTC GTG ATG ATC ATC CGC TGT GCC AAG GTC ATC ATG GAC CCT TAC AGC GCC ATC CCC ACA TCC ACC TGG GAG GAG CAG CAC CTG GAC GAC	59	0.598870	0.317708	0.786458	0.230357	false	L1_short	drop_stop	balanced	high_regularity	q4	150	0.202778	0.265191	true
human	lcl|NC_000015.10_cds_NP_001401822.1_96438	ATGATGGTGCGGGGAAGGCACCGCGGCCTTGGCCAGCTGAGTCGCGACGGCCGCCGGGGCGGCGGCAGTGGCCGCGGCAGCGGCGGTGGTAGCGGGCTCCCCAGCGGCATGCCAGTGCCCCCCGGGCGCGATGGCTAG	ATG ATG GTG CGG GGA AGG CAC CGC GGC CTT GGC CAG CTG AGT CGC GAC GGC CGC CGG GGC GGC GGC AGT GGC CGC GGC AGC GGC GGT GGT AGC GGG CTC CCC AGC GGC ATG CCA GTG CCC CCC GGG CGC GAT GGC	45	0.785185	0.304167	0.791667	0.347222	false	L1_short	drop_stop	balanced	high_regularity	q4	150	0.202778	0.265191	true
human	lcl|NC_000016.10_cds_NP_001291927.1_101893	ATGTGGTATGGTGTATTCCTGTGGGCACTGGTGTCTTCTCTCTTCTTTCATGTCCCTGCTGGATTACTGGCCCTCTTCACCCTCAGACATCACAAATATGGTGCAGCTATTGCTGGAGTTTACCGAGCAGCAGGGAAGGAAATGATACCATTTGAAGCCCTCACACTGGGCACTGGACAGACATTTTGCGTCTTGGTGGTCTCCTTTTTACGGATTTTAGCTACTCTATAG	ATG TGG TAT GGT GTA TTC CTG TGG GCA CTG GTG TCT TCT CTC TTC TTT CAT GTC CCT GCT GGA TTA CTG GCC CTC TTC ACC CTC AGA CAT CAC AAA TAT GGT GCA GCT ATT GCT GGA GTT TAC CGA GCA GCA GGG AAG GAA ATG ATA CCA TTT GAA GCC CTC ACA CTG GGC ACT GGA CAG ACA TTT TGC GTC TTG GTG GTC TCC TTT TTA CGG ATT TTA GCT ACT CTA	76	0.478070	0.200000	0.937500	0.221429	false	L1_short	drop_stop	balanced	low_regularity	q1	150	0.202778	0.265191	true
human	lcl|NC_000016.10_cds_NP_001335590.1_100229	ATGTCTGCAACTCGAGCCAAGAAAGTGAAGATGGCCACCAAATCATGCCCCGAGTGCGACCAACAGGTTCCTGTTGCATGTAAATCATGTCCTTGTGGTTACATATTTATTAGCAGAAAACTTTTAAATGCAAAACACTCAGAGAAATCACCACCTTCTACAGGGTCTCAAAAAATTTGCTACCAATACTGCCTTTCTCAGGAAGCCCCTACAAGTTACCTGCTACCAAAATGA	ATG TCT GCA ACT CGA GCC AAG AAA GTG AAG ATG GCC ACC AAA TCA TGC CCC GAG TGC GAC CAA CAG GTT CCT GTT GCA TGT AAA TCA TGT CCT TGT GGT TAC ATA TTT ATT AGC AGA AAA CTT TTA AAT GCA AAA CAC TCA GAG AAA TCA CCA CCT TCT ACA GGG TCT CAA AAA ATT TGC TAC CAA TAC TGC CTT TCT CAG GAA GCC CCT ACA AGT TAC CTG CTA CCA AAA	77	0.424242	0.182500	0.925000	0.135714	false	L1_short	drop_stop	balanced	low_regularity	q1	150	0.202778	0.265191	true
