species	seq_id	cds_nt	codon_tokens	num_codons	gc_content	dominant_reference_coverage	avg_window_heterogeneity	sparse_difference_ratio	has_internal_stop	length_group	terminal_stop_policy	sampling_view	regularity_group	regularity_quartile	regularity_bin_n	regularity_q1	regularity_q3	regularity_is_reportable
ecoli	lcl|U00096.3_cds_AAC77159.1_4123	ATGGCACGTTATTTCCGTCGTCGCAAGTTCTGCCGTTTCACCGCGGAAGGCGTTCAAGAGATCGACTATAAAGATATCGCTACGCTGAAAAACTACATCACCGAAAGCGGTAAGATTGTCCCAAGCCGTATCACCGGTACCCGTGCAAAATACCAGCGTCAGCTGGCTCGCGCTATCAAACGCGCTCGCTACCTGTCCCTGCTGCCGTACACTGATCGCCATCAGTAA	ATG GCA CGT TAT TTC CGT CGT CGC AAG TTC TGC CGT TTC ACC GCG GAA GGC GTT CAA GAG ATC GAC TAT AAA GAT ATC GCT ACG CTG AAA AAC TAC ATC ACC GAA AGC GGT AAG ATT GTC CCA AGC CGT ATC ACC GGT ACC CGT GCA AAA TAC CAG CGT CAG CTG GCT CGC GCT ATC AAA CGC GCT CGC TAC CTG TCC CTG CTG CCG TAC ACT GAT CGC CAT CAG	75	0.533333	0.258333	0.862500	0.185238	false	L1_short	drop_stop	balanced	high_regularity	q4	150	0.192894	0.250000	true
ecoli	lcl|U00096.3_cds_AAC77203.1_4164	ATGGTTCAGTGTGTTCGACATTTTGTCTTACCGCGTCTGAAAAAAGACGCTGGCCTGCCGTTTTTCTTCCCGTTGATCACCCATTCCCAGCCCCTCAATCGAGGGGCTTTTTTTTGCCCAGGCGTCAGGAGATAA	ATG GTT CAG TGT GTT CGA CAT TTT GTC TTA CCG CGT CTG AAA AAA GAC GCT GGC CTG CCG TTT TTC TTC CCG TTG ATC ACC CAT TCC CAG CCC CTC AAT CGA GGG GCT TTT TTT TGC CCA GGC GTC AGG AGA	44	0.515152	0.229167	0.895833	0.182540	false	L1_short	drop_stop	balanced	mid_regularity	q3	150	0.192894	0.250000	true
ecoli	lcl|U00096.3_cds_AAC77309.1_4268	ATGTTTGGTAACTTAGGACAGGCAAAAAAATATCTCGGCCAGGCGGCGAAGATGTTGATTGGCATTCCAGACTACGACAACTACGTCGAGCATATGAAGACCAACCATCCCGACAAGCCGTACATGAGCTATGAAGAATTCTTCCGCGAACGCCAGAACGCGCGCTACGGCGGCGATGGTAAAGGCGGTATGCGCTGTTGTTAA	ATG TTT GGT AAC TTA GGA CAG GCA AAA AAA TAT CTC GGC CAG GCG GCG AAG ATG TTG ATT GGC ATT CCA GAC TAC GAC AAC TAC GTC GAG CAT ATG AAG ACC AAC CAT CCC GAC AAG CCG TAC ATG AGC TAT GAA GAA TTC TTC CGC GAA CGC CAG AAC GCG CGC TAC GGC GGC GAT GGT AAA GGC GGT ATG CGC TGT TGT	67	0.512438	0.310185	0.796296	0.118519	false	L1_short	drop_stop	balanced	high_regularity	q4	150	0.192894	0.250000	true
ecoli	lcl|U00096.3_cds_AAC77355.1_4316	ATGACTAAAGTACGTAATTGCGTTCTTGATGCACTTTCCATCAACGTCAACAACATCATTAGCTTGGTCGTGGGTACTTTCCCTCAGGACCCGACAGTGTCAAAAACGGCTGTCATCCTAACCATTTTAACAGCAACATAA	ATG ACT AAA GTA CGT AAT TGC GTT CTT GAT GCA CTT TCC ATC AAC GTC AAC AAC ATC ATT AGC TTG GTC GTG GGT ACT TTC CCT CAG GAC CCG ACA GTG TCA AAA ACG GCT GTC ATC CTA ACC ATT TTA ACA GCA ACA	46	0.434783	0.201389	0.930556	0.186508	false	L1_short	drop_stop	balanced	mid_regularity	q2	150	0.192894	0.250000	true
ecoli	lcl|U00096.3_cds_AAC77487.1_3709	ATGACAGCCCTTCTACGAGTGATTAGCCTGGTCGTGATTAGCGTGGTGGTGATTATTATCCCACCGTGCGGGGCTGCACTTGGACGAGGAAAGGCTTAG	ATG ACA GCC CTT CTA CGA GTG ATT AGC CTG GTC GTG ATT AGC GTG GTG GTG ATT ATT ATC CCA CCG TGC GGG GCT GCA CTT GGA CGA GGA AAG GCT	32	0.541667	0.250000	0.812500	0.183333	false	L1_short	drop_stop	balanced	high_regularity	q3	150	0.192894	0.250000	true
ecoli	lcl|U00096.3_cds_AAD13451.4_3821	ATGGCGATGAATACGGTTTTTCTTCATTTATCAGAAGAGGCAATTAAACGGCTGAACAAGCTTCGGGGCTGGCGTAAGGTTTCACGATCTGCAATTTTACGCGAAGCGGTAGAGCAATATCTGGAACGTCAGCAATTCCCGGTGCGTAAAGCAAAGGGAGGCAGGCAAAAGGGGGAGGTAGTTGGTGTTGATGATCAGTGTAAGGAGCATAAGGAATGA	ATG GCG ATG AAT ACG GTT TTT CTT CAT TTA TCA GAA GAG GCA ATT AAA CGG CTG AAC AAG CTT CGG GGC TGG CGT AAG GTT TCA CGA TCT GCA ATT TTA CGC GAA GCG GTA GAG CAA TAT CTG GAA CGT CAG CAA TTC CCG GTG CGT AAA GCA AAG GGA GGC AGG CAA AAG GGG GAG GTA GTT GGT GTT GAT GAT CAG TGT AAG GAG CAT AAG GAA	72	0.472222	0.180556	0.944444	0.243386	false	L1_short	drop_stop	balanced	low_regularity	q1	150	0.192894	0.250000	true
ecoli	lcl|U00096.3_cds_AAT48125.1_573	ATGCTGACGAAATATGCCCTTGCGGCAGTCATAGTGCTGTGTTTAACGGTGCTGGGATTTACGCTTCTGGTCGGAGACTCGCTGTGTGAGTTTACGGTGAAGGAACGTAATATTGAGTTTAAGGCTGTTCTCGCTTACGAACCGAAGAAGTAG	ATG CTG ACG AAA TAT GCC CTT GCG GCA GTC ATA GTG CTG TGT TTA ACG GTG CTG GGA TTT ACG CTT CTG GTC GGA GAC TCG CTG TGT GAG TTT ACG GTG AAG GAA CGT AAT ATT GAG TTT AAG GCT GTT CTC GCT TAC GAA CCG AAG AAG	50	0.480000	0.285714	0.892857	0.132653	false	L1_short	drop_stop	balanced	high_regularity	q4	150	0.192894	0.250000	true
ecoli	lcl|U00096.3_cds_AAT48130.1_1408	ATGAAGCACAACCCTCTGGTGGTGTGTCTGCTCATTATCTGCATTACGATTCTGACATTCACACTCCTGACCCGACAAACGCTCTACGAACTGCGGTTCCGGGACGGTGATAAGGAGGTTGCTGCGCTCATGGCCTGCACGTCCAGGTAA	ATG AAG CAC AAC CCT CTG GTG GTG TGT CTG CTC ATT ATC TGC ATT ACG ATT CTG ACA TTC ACA CTC CTG ACC CGA CAA ACG CTC TAC GAA CTG CGG TTC CGG GAC GGT GAT AAG GAG GTT GCT GCG CTC ATG GCC TGC ACG TCC AGG	49	0.544218	0.303571	0.928571	0.156463	false	L1_short	drop_stop	balanced	high_regularity	q4	150	0.192894	0.250000	true
ecoli	lcl|U00096.3_cds_AAT48132.1_1618	ATGAATCGTCTTATTGAATTAACAGGTTGGATCGTTCTTGTCGTTTCAGTCATTCTTCTTGGCGTGGCGAGTCACATTGACAACTATCAGCCACCTGAACAGAGTGCTTCGGTACAACACAAGTAA	ATG AAT CGT CTT ATT GAA TTA ACA GGT TGG ATC GTT CTT GTC GTT TCA GTC ATT CTT CTT GGC GTG GCG AGT CAC ATT GAC AAC TAT CAG CCA CCT GAA CAG AGT GCT TCG GTA CAA CAC AAG	41	0.439024	0.312500	0.958333	0.182540	false	L1_short	drop_stop	balanced	high_regularity	q4	150	0.192894	0.250000	true
ecoli	lcl|U00096.3_cds_AAT48191.1_3496	ATGCCGCAGAAATATAGATTACTTTCTTTAATAGTGATTTGTTTCACGCTTTTATTTTTCACCTGGATGATAAGAGATTCACTGTGTGAATTGCATATTAAACAGGAGAGTTATGAGCTGGCGGCGTTTTTAGCCTGCAAATTGAAAGAGTAA	ATG CCG CAG AAA TAT AGA TTA CTT TCT TTA ATA GTG ATT TGT TTC ACG CTT TTA TTT TTC ACC TGG ATG ATA AGA GAT TCA CTG TGT GAA TTG CAT ATT AAA CAG GAG AGT TAT GAG CTG GCG GCG TTT TTA GCC TGC AAA TTG AAA GAG	50	0.360000	0.214286	0.964286	0.068027	false	L1_short	drop_stop	balanced	mid_regularity	q2	150	0.192894	0.250000	true
ecoli	lcl|U00096.3_cds_AAT48237.1_3913	ATGCAGATCCTGTTTAACGATCAAGCGATGCAGTGCGCCGCCGGGCAAACTGTTCACGAACTACTGGAGCAACTCGACCAACGACAAGCGGGCGCGGCTCTGGCGATTAATCAGCAAATCGTCCCGCGTGAGCAGTGGGCGCAACATATCGTGCAGGATGGCGACCAGATCCTGCTTTTTCAGGTTATTGCAGGGGGTTGA	ATG CAG ATC CTG TTT AAC GAT CAA GCG ATG CAG TGC GCC GCC GGG CAA ACT GTT CAC GAA CTA CTG GAG CAA CTC GAC CAA CGA CAA GCG GGC GCG GCT CTG GCG ATT AAT CAG CAA ATC GTC CCG CGT GAG CAG TGG GCG CAA CAT ATC GTG CAG GAT GGC GAC CAG ATC CTG CTT TTT CAG GTT ATT GCA GGG GGT	66	0.560606	0.208333	0.944444	0.230159	false	L1_short	drop_stop	balanced	mid_regularity	q2	150	0.192894	0.250000	true
ecoli	lcl|U00096.3_cds_AAT48241.1_4069	ATGATGAAACGCCTTATCGTTCTTGTTTTGCTTGCCAGCACGCTGCTCACGGGCTGTAACACCGCTCGCGGTTTCGGCGAAGACATCAAACATCTCGGCAACTCCATCTCTCGCGCTGCCAGCTAA	ATG ATG AAA CGC CTT ATC GTT CTT GTT TTG CTT GCC AGC ACG CTG CTC ACG GGC TGT AAC ACC GCT CGC GGT TTC GGC GAA GAC ATC AAA CAT CTC GGC AAC TCC ATC TCT CGC GCT GCC AGC	41	0.552846	0.291667	0.958333	0.099206	false	L1_short	drop_stop	balanced	high_regularity	q4	150	0.192894	0.250000	true
ecoli	lcl|U00096.3_cds_ABD18634.1_241	ATGAAAATTATCAGTAAACGCAGGGCAATGACGATATACCGCCAGCATCCTGAGTCCCGAATCTTTCGCTACTGCACCGGCAAATACCAGTGGCACGGTAGCGTCTGTCATTACACCGGCAGGGACGTTCCGGATATCGCCGGAGTCCTCGCGGTATACGCCGAACGCCGCCAGGACCGCAATGGGCCCTATACCTGCCTGATGAGCATCACCCTGAACTGA	ATG AAA ATT ATC AGT AAA CGC AGG GCA ATG ACG ATA TAC CGC CAG CAT CCT GAG TCC CGA ATC TTT CGC TAC TGC ACC GGC AAA TAC CAG TGG CAC GGT AGC GTC TGT CAT TAC ACC GGC AGG GAC GTT CCG GAT ATC GCC GGA GTC CTC GCG GTA TAC GCC GAA CGC CGC CAG GAC CGC AAT GGG CCC TAT ACC TGC CTG ATG AGC ATC ACC CTG AAC	73	0.561644	0.250000	0.950000	0.092857	false	L1_short	drop_stop	balanced	high_regularity	q3	150	0.192894	0.250000	true
ecoli	lcl|U00096.3_cds_ABD18636.1_292	ATGAAAGTTCTTAACTCTCTGCGTACCGCAAAAGAACGCCATCCAGACTGTCAGATTGTGAAGCGAAAAGGACGGCTATATGTGATTTGTAAATCTAATCCACGTTTTAAGGCCGTTCAGGGTCGTAAGAAAAAACGTTGA	ATG AAA GTT CTT AAC TCT CTG CGT ACC GCA AAA GAA CGC CAT CCA GAC TGT CAG ATT GTG AAG CGA AAA GGA CGG CTA TAT GTG ATT TGT AAA TCT AAT CCA CGT TTT AAG GCC GTT CAG GGT CGT AAG AAA AAA CGT	46	0.420290	0.159722	0.944444	0.160714	false	L1_short	drop_stop	balanced	low_regularity	q1	150	0.192894	0.250000	true
ecoli	lcl|U00096.3_cds_ABD18640.1_547	ATGCGAAAGCTGAAAATGATGCTCTGCGTGATGATGTTGCCGCTGGTCGTCGTCGGTTGCACATCAAAGCAGTCTGTCAGTCAGTGCGTGAAGCCACCACGGCCTCCGGCGTGGATAATGCAGCCTCCCCCCGACTGGCAGACACCGCTGAACGGGATTATTTCACCCTCAGAGAGAGGCTGA	ATG CGA AAG CTG AAA ATG ATG CTC TGC GTG ATG ATG TTG CCG CTG GTC GTC GTC GGT TGC ACA TCA AAG CAG TCT GTC AGT CAG TGC GTG AAG CCA CCA CGG CCT CCG GCG TGG ATA ATG CAG CCT CCC CCC GAC TGG CAG ACA CCG CTG AAC GGG ATT ATT TCA CCC TCA GAG AGA GGC	60	0.572222	0.234375	0.890625	0.148214	false	L1_short	drop_stop	balanced	mid_regularity	q3	150	0.192894	0.250000	true
ecoli	lcl|U00096.3_cds_ABD18641.1_578	ATGGCATTCAGTAATCCCTTCGATGATCCGCAGGGAGCGTTTTACATATTGCGCAATGCGCAGGGGCAATTCAGTCTGTGGCCGCAACAATGCGTCTTACCGGCAGGCTGGGACATTGTGTGTCAGCCGCAGTCACAGGCGTCCTGCCAGCAGTGGCTGGAAGCCCACTGGCGTACTCTGACACCGACGAATTTTACCCAGTTGCAGGAGGCACAATGA	ATG GCA TTC AGT AAT CCC TTC GAT GAT CCG CAG GGA GCG TTT TAC ATA TTG CGC AAT GCG CAG GGG CAA TTC AGT CTG TGG CCG CAA CAA TGC GTC TTA CCG GCA GGC TGG GAC ATT GTG TGT CAG CCG CAG TCA CAG GCG TCC TGC CAG CAG TGG CTG GAA GCC CAC TGG CGT ACT CTG ACA CCG ACG AAT TTT ACC CAG TTG CAG GAG GCA CAA	72	0.560185	0.208333	0.916667	0.112169	false	L1_short	drop_stop	balanced	mid_regularity	q2	150	0.192894	0.250000	true
ecoli	lcl|U00096.3_cds_ABD18642.1_592	ATGTTTGATTCACTGGCAAAAGCCGGAAAATATTTAGGTCAGGCGGCGAAGCTGATGATTGGTATGCCTGATTACGACAACTATGTCGAACATATGCGGGTTAACCATCCCGATCAAACGCCGATGACCTACGAAGAGTTTTTCCGTGAGCGGCAGGACGCGCGCTACGGTGGAAAAGGCGGCGCGCGCTGCTGCTAA	ATG TTT GAT TCA CTG GCA AAA GCC GGA AAA TAT TTA GGT CAG GCG GCG AAG CTG ATG ATT GGT ATG CCT GAT TAC GAC AAC TAT GTC GAA CAT ATG CGG GTT AAC CAT CCC GAT CAA ACG CCG ATG ACC TAC GAA GAG TTT TTC CGT GAG CGG CAG GAC GCG CGC TAC GGT GGA AAA GGC GGC GCG CGC TGC TGC	65	0.528205	0.263889	0.958333	0.193122	false	L1_short	drop_stop	balanced	high_regularity	q4	150	0.192894	0.250000	true
ecoli	lcl|U00096.3_cds_ABD18645.1_716	ATGTGGTATTTCGCATGGATTCTGGGAACGCTTCTTGCCTGTTCGTTTGGGGTAATCACCGCGCTGGCGCTTGAACACGTCGAATCAGGCAAAGCCGGTCAAGAAGACATCTGA	ATG TGG TAT TTC GCA TGG ATT CTG GGA ACG CTT CTT GCC TGT TCG TTT GGG GTA ATC ACC GCG CTG GCG CTT GAA CAC GTC GAA TCA GGC AAA GCC GGT CAA GAA GAC ATC	37	0.522523	0.240000	0.900000	0.100000	false	L1_short	drop_stop	balanced	mid_regularity	q3	150	0.192894	0.250000	true
ecoli	lcl|U00096.3_cds_ABD18656.2_1256	ATGGTCGGTCAGGAGCAACTGGAGTCGTCACCATTATGCCAGCATAGTGACAATGAAACAGAAACGAAACGGGAATGTTCCGTCGTTATTCCAGACGACTGGCAACTAACATCGCAGCAGCAAGCCTTTATAGAACTGTTTGCTGAAGATGATCAGCCGAAACAATAA	ATG GTC GGT CAG GAG CAA CTG GAG TCG TCA CCA TTA TGC CAG CAT AGT GAC AAT GAA ACA GAA ACG AAA CGG GAA TGT TCC GTC GTT ATT CCA GAC GAC TGG CAA CTA ACA TCG CAG CAG CAA GCC TTT ATA GAA CTG TTT GCT GAA GAT GAT CAG CCG AAA CAA	55	0.466667	0.219388	0.908163	0.144218	false	L1_short	drop_stop	balanced	mid_regularity	q3	150	0.192894	0.250000	true
ecoli	lcl|U00096.3_cds_ABD18660.1_1352	ATGCGAAAGCTGAAAATGATGCTCTGCGTGATGATGTTGCCGCTGGTCGTCGTCGGTTGCACATCAAAGCAGTCTGTCAGTCAGTGCGTGAAGCCACCACCGCCTCCGGCGTGGATAATGCAGCCTCCCCCCGACTGGCAGACACCGCTGAACGGGATTATTTCACCCTCCGGGAACGACTGGTAA	ATG CGA AAG CTG AAA ATG ATG CTC TGC GTG ATG ATG TTG CCG CTG GTC GTC GTC GGT TGC ACA TCA AAG CAG TCT GTC AGT CAG TGC GTG AAG CCA CCA CCG CCT CCG GCG TGG ATA ATG CAG CCT CCC CCC GAC TGG CAG ACA CCG CTG AAC GGG ATT ATT TCA CCC TCC GGG AAC GAC TGG	61	0.579235	0.243750	0.875000	0.224107	false	L1_short	drop_stop	balanced	mid_regularity	q3	150	0.192894	0.250000	true
ecoli	lcl|U00096.3_cds_ABD18667.1_1537	ATGTCAACGAAGAACAGAACCCGCAGAACAACAACCCGCAACATCCGCTTTCCTAACCAAATGATTGAACAAATTAACATCGCTCTTGAGCAAAAAGGGTCCGGGAATTTCTCAGCCTGGGTCATTGAAGCCTGCCGCCGGAGACTGTGCTCAGAAAAAAGAGTTTCTTCTGAAGCAAACAAAGAAAAGAGTGACATTACTGAATTGCTCAGAAAACAGGTCAGACCAGATTGA	ATG TCA ACG AAG AAC AGA ACC CGC AGA ACA ACA ACC CGC AAC ATC CGC TTT CCT AAC CAA ATG ATT GAA CAA ATT AAC ATC GCT CTT GAG CAA AAA GGG TCC GGG AAT TTC TCA GCC TGG GTC ATT GAA GCC TGC CGC CGG AGA CTG TGC TCA GAA AAA AGA GTT TCT TCT GAA GCA AAC AAA GAA AAG AGT GAC ATT ACT GAA TTG CTC AGA AAA CAG GTC AGA CCA GAT	77	0.445887	0.182500	0.937500	0.214286	false	L1_short	drop_stop	balanced	low_regularity	q1	150	0.192894	0.250000	true
ecoli	lcl|U00096.3_cds_ABD18671.2_1714	ATGCCGACTAAACGCTTTGATAAAAAACACTGGAAGATGGTGGTGGTGCTACTGGCAATCTGTGGCGCTATGTTGTTGCTACGTTGGGCAGCAATGATTTGGGGCTGA	ATG CCG ACT AAA CGC TTT GAT AAA AAA CAC TGG AAG ATG GTG GTG GTG CTA CTG GCA ATC TGT GGC GCT ATG TTG TTG CTA CGT TGG GCA GCA ATG ATT TGG GGC	35	0.485714	0.266667	0.875000	0.068571	false	L1_short	drop_stop	balanced	high_regularity	q4	150	0.192894	0.250000	true
ecoli	lcl|U00096.3_cds_ABD18672.1_1823	ATGCGATTCATCATTCGCACAGTTATGCTGATAGCACTGGTATGGATAGGATTATTACTCAGCGGATATGGCGTTTTGATTGGAAGCAAAGAGAATGCCGCAGGATTAGGTTTGCAATGTACCTATCTGACTGCCAGAGGCACCAGCACGGTACAATACTTGCACACTAAAAGTGGTTTTTTGGGGATAACAGATTGCCCGCTGTTACGCAAAAGCAATATCGTGGTCGATAATGGTTAA	ATG CGA TTC ATC ATT CGC ACA GTT ATG CTG ATA GCA CTG GTA TGG ATA GGA TTA TTA CTC AGC GGA TAT GGC GTT TTG ATT GGA AGC AAA GAG AAT GCC GCA GGA TTA GGT TTG CAA TGT ACC TAT CTG ACT GCC AGA GGC ACC AGC ACG GTA CAA TAC TTG CAC ACT AAA AGT GGT TTT TTG GGG ATA ACA GAT TGC CCG CTG TTA CGC AAA AGC AAT ATC GTG GTC GAT AAT GGT	79	0.443038	0.178571	0.923214	0.160476	false	L1_short	drop_stop	balanced	low_regularity	q1	150	0.192894	0.250000	true
ecoli	lcl|U00096.3_cds_ABD18688.1_2110	ATGCGCATAGCTAAAATTGGGGTCATCGCCCTGTTCCTGTTTATGGCGTTAGGCGGAATTGGTGGCGTCATGCTCGCAGGTTATACCTTTATTTTGCGTGCTGGCTAA	ATG CGC ATA GCT AAA ATT GGG GTC ATC GCC CTG TTC CTG TTT ATG GCG TTA GGC GGA ATT GGT GGC GTC ATG CTC GCA GGT TAT ACC TTT ATT TTG CGT GCT GGC	35	0.504762	0.216667	0.950000	0.161905	false	L1_short	drop_stop	balanced	mid_regularity	q2	150	0.192894	0.250000	true
ecoli	lcl|U00096.3_cds_ABD18695.1_2343	ATGCAACACGAACTACAGCCTGATTCACTGGTTGATTTGAAATTCATCATGGCTGATACTGGCTTTGGTAAAACCTTCATCTATGACCGGATTAAGTCAGGCGACCTGCCAAAAGCCAAAGTTATCCACGGGCGAGCAAGATGGTTATATCGTGACCATTGTGAATTCAAAAATAAGCTCTTAAGCCGCGCCAATGGGTAA	ATG CAA CAC GAA CTA CAG CCT GAT TCA CTG GTT GAT TTG AAA TTC ATC ATG GCT GAT ACT GGC TTT GGT AAA ACC TTC ATC TAT GAC CGG ATT AAG TCA GGC GAC CTG CCA AAA GCC AAA GTT ATC CAC GGG CGA GCA AGA TGG TTA TAT CGT GAC CAT TGT GAA TTC AAA AAT AAG CTC TTA AGC CGC GCC AAT GGG	66	0.444444	0.180556	0.986111	0.079365	false	L1_short	drop_stop	balanced	low_regularity	q1	150	0.192894	0.250000	true
ecoli	lcl|U00096.3_cds_ABD18696.1_2387	ATGGAAAAAGAGCAGCTGATTGAAATAGCCAATACGATAATGCCGTTTGGCAAATACAAAGGGCGTCGCTTAATCGACCTGCCGGAGGAGTATCTGCTGTGGTTTGCCCGCAAAGATGAGTTCCCGGCAGGGAAGCTCGGTGAGCTAATGCAAATCACGCTGCTGATTAAAACCGAGGGGCTGACGCAACTGGTCCAGCCCCTGAAGCGTCCGCTTTAA	ATG GAA AAA GAG CAG CTG ATT GAA ATA GCC AAT ACG ATA ATG CCG TTT GGC AAA TAC AAA GGG CGT CGC TTA ATC GAC CTG CCG GAG GAG TAT CTG CTG TGG TTT GCC CGC AAA GAT GAG TTC CCG GCA GGG AAG CTC GGT GAG CTA ATG CAA ATC ACG CTG CTG ATT AAA ACC GAG GGG CTG ACG CAA CTG GTC CAG CCC CTG AAG CGT CCG CTT	72	0.523148	0.208333	0.902778	0.142857	false	L1_short	drop_stop	balanced	mid_regularity	q2	150	0.192894	0.250000	true
ecoli	lcl|U00096.3_cds_ABD18697.1_2451	ATGGACTGGCTGGCTAAATATTGGTGGATTCTGGTGATTGTCTTTTTGGTAGGCGTCCTGCTGAACGTGATTAAAGATCTCAAGCGCGTCGACCATAAGAAATTTCTCGCCAACAAGCCGGAGCTTCCCCCGCATCGTGATTTCAACGATAAGTGGGACGATGACGACGACTGGCCGAAAAAGGATCAACCGAAGAAGTAA	ATG GAC TGG CTG GCT AAA TAT TGG TGG ATT CTG GTG ATT GTC TTT TTG GTA GGC GTC CTG CTG AAC GTG ATT AAA GAT CTC AAG CGC GTC GAC CAT AAG AAA TTT CTC GCC AAC AAG CCG GAG CTT CCC CCG CAT CGT GAT TTC AAC GAT AAG TGG GAC GAT GAC GAC GAC TGG CCG AAA AAG GAT CAA CCG AAG AAG	66	0.489899	0.319444	0.833333	0.204233	false	L1_short	drop_stop	balanced	high_regularity	q4	150	0.192894	0.250000	true
ecoli	lcl|U00096.3_cds_ABD18698.1_2621	ATGAGAATTATCAGTAAACGCCGGGCAATGACGATATACCGCCAGCATCCTGAGTCCCGAATCTTTCGCTACTGCACCGGAAAATATCAGTGGCACGGTAGCGTCTGTCATTACACCGGCAGGGATGTTCCGGATATCACAGGAGTCCTGGCTGTGTACGCCGAACGCCGCAGGACCGCAGCGGACCGTATGCTTGACTGA	ATG AGA ATT ATC AGT AAA CGC CGG GCA ATG ACG ATA TAC CGC CAG CAT CCT GAG TCC CGA ATC TTT CGC TAC TGC ACC GGA AAA TAT CAG TGG CAC GGT AGC GTC TGT CAT TAC ACC GGC AGG GAT GTT CCG GAT ATC ACA GGA GTC CTG GCT GTG TAC GCC GAA CGC CGC AGG ACC GCA GCG GAC CGT ATG CTT GAC	66	0.550505	0.180556	0.986111	0.066138	false	L1_short	drop_stop	balanced	low_regularity	q1	150	0.192894	0.250000	true
ecoli	lcl|U00096.3_cds_ABD18701.1_3286	ATGGCAATCCGAAAACGTTTTATTGCGGGCGCAAAATGCCCGGCCTGTCAGGCGCAGGATTCAATGGCGATGTGGCGCGAAAATAATATTGATATTGTTGAATGTGTTAAGTGCGGACATCAGATGCGAGAAGCAGACAAAGAAGCCCGCGATCACGTTCGCAAAGATGAGCAAGTGATCGGGATTTTTCATCCGGACTAG	ATG GCA ATC CGA AAA CGT TTT ATT GCG GGC GCA AAA TGC CCG GCC TGT CAG GCG CAG GAT TCA ATG GCG ATG TGG CGC GAA AAT AAT ATT GAT ATT GTT GAA TGT GTT AAG TGC GGA CAT CAG ATG CGA GAA GCA GAC AAA GAA GCC CGC GAT CAC GTT CGC AAA GAT GAG CAA GTG ATC GGG ATT TTT CAT CCG GAC	66	0.484848	0.236111	0.875000	0.145503	false	L1_short	drop_stop	balanced	mid_regularity	q3	150	0.192894	0.250000	true
ecoli	lcl|U00096.3_cds_ABD18704.1_3544	ATGGGCAAATTAGGTGAAAACGTTCCGCTTCTTATCGATAAAGCCGTAGATTTCATGGCATCAAGCCAGGCGTTCCGGGAGTATCTGAAAAAACTTCCTCCCCGTAACGCGATTCCGTCCGGAATACCCGATGAAAGCGTGCCGTTATATCTACAACGTCTGGAGTATTATCGTCGGCTTTATCGGCCGAAGCAGGTAGAGGGGCAGTAA	ATG GGC AAA TTA GGT GAA AAC GTT CCG CTT CTT ATC GAT AAA GCC GTA GAT TTC ATG GCA TCA AGC CAG GCG TTC CGG GAG TAT CTG AAA AAA CTT CCT CCC CGT AAC GCG ATT CCG TCC GGA ATA CCC GAT GAA AGC GTG CCG TTA TAT CTA CAA CGT CTG GAG TAT TAT CGT CGG CTT TAT CGG CCG AAG CAG GTA GAG GGG CAG	69	0.497585	0.211111	0.908333	0.105820	false	L1_short	drop_stop	balanced	mid_regularity	q2	150	0.192894	0.250000	true
ecoli	lcl|U00096.3_cds_ABD18711.1_4050	ATGGCACTATTCTCTAAAATATTAATTTTTTATGTGATTGGTGTGAACATATCCTTTGTCATTATCTGGTTTATCTCACATGAGAAAACACATATTCGTTTACTTAGTGCATTCCTGGTCGGAATAACCTGGCCAATGAGTCTGCCTGTGGCATTACTTTTTTCTCTCTTTTAG	ATG GCA CTA TTC TCT AAA ATA TTA ATT TTT TAT GTG ATT GGT GTG AAC ATA TCC TTT GTC ATT ATC TGG TTT ATC TCA CAT GAG AAA ACA CAT ATT CGT TTA CTT AGT GCA TTC CTG GTC GGA ATA ACC TGG CCA ATG AGT CTG CCT GTG GCA TTA CTT TTT TCT CTC TTT	57	0.350877	0.281250	0.937500	0.113095	false	L1_short	drop_stop	balanced	high_regularity	q4	150	0.192894	0.250000	true
ecoli	lcl|U00096.3_cds_ABD18719.1_4283	ATGTTGCAACGTACGCTGGGCAGTGGCTGGGGAGTGTTGCTGCCGGGATTGCTGATTGCAGGGCTGATGTATGCGGATTTATCGTCAGATCAGTGGCGGATTGTCATTCTGATGGGATTAGTATTGACGCCGATGATGCTGTATCACAAACAGTTGCGGCATTACATTTTGCTACCATCGTGCCTGGCACTTATTGCTGGCATCATGCTGATGATAATGAATTTGAATCAGGGATGA	ATG TTG CAA CGT ACG CTG GGC AGT GGC TGG GGA GTG TTG CTG CCG GGA TTG CTG ATT GCA GGG CTG ATG TAT GCG GAT TTA TCG TCA GAT CAG TGG CGG ATT GTC ATT CTG ATG GGA TTA GTA TTG ACG CCG ATG ATG CTG TAT CAC AAA CAG TTG CGG CAT TAC ATT TTG CTA CCA TCG TGC CTG GCA CTT ATT GCT GGC ATC ATG CTG ATG ATA ATG AAT TTG AAT CAG GGA	78	0.482906	0.220833	0.908333	0.226190	false	L1_short	drop_stop	balanced	mid_regularity	q3	150	0.192894	0.250000	true
ecoli	lcl|U00096.3_cds_ABD18720.2_4290	ATGTTTCGTTGGGGCATCATATTTCTGGTTATCGCGTTAATCGCCGCCGCACTTGGGTTTGGTGGTCTGGCCGGTACCGCTGCAGGCGCAGCTAAAATTGTCTTTGTCGTCGGGATTATTCTGTTCCTGGTGAGTTTGTTCATGGGCCGAAAACGACCCTAG	ATG TTT CGT TGG GGC ATC ATA TTT CTG GTT ATC GCG TTA ATC GCC GCC GCA CTT GGG TTT GGT GGT CTG GCC GGT ACC GCT GCA GGC GCA GCT AAA ATT GTC TTT GTC GTC GGG ATT ATT CTG TTC CTG GTG AGT TTG TTC ATG GGC CGA AAA CGA CCC	53	0.522013	0.289286	0.757143	0.171429	false	L1_short	drop_stop	balanced	high_regularity	q4	150	0.192894	0.250000	true
ecoli	lcl|U00096.3_cds_ABP93436.1_551	ATGTCAACTAAGAACAGAACCCGCAGAACAACAACCCGCAACATCCGCTTTCCTAACCAAATGATTGAACAAATTAACATCGCTCTTGAGCAAAAAGGGTCCGGGAATTTCTCAGCCTGGGTCATTGAAGCCTGCCGTCGGAGGCTAACGTCAGAAAAGAGAGCATATACATCAATTAAAAGTGATGAAGAATGA	ATG TCA ACT AAG AAC AGA ACC CGC AGA ACA ACA ACC CGC AAC ATC CGC TTT CCT AAC CAA ATG ATT GAA CAA ATT AAC ATC GCT CTT GAG CAA AAA GGG TCC GGG AAT TTC TCA GCC TGG GTC ATT GAA GCC TGC CGT CGG AGG CTA ACG TCA GAA AAG AGA GCA TAT ACA TCA ATT AAA AGT GAT GAA GAA	64	0.437500	0.187500	0.921875	0.232143	false	L1_short	drop_stop	balanced	low_regularity	q1	150	0.192894	0.250000	true
ecoli	lcl|U00096.3_cds_ABP93439.1_956	ATGTGGTATTTACTTTGGTTCGTCGGCATTTTGTTGATGTGTTCGCTCTCCACCCTTGTGTTGGTATGGCTGGACCCGCGTCTGAAAAGTTAA	ATG TGG TAT TTA CTT TGG TTC GTC GGC ATT TTG TTG ATG TGT TCG CTC TCC ACC CTT GTG TTG GTA TGG CTG GAC CCG CGT CTG AAA AGT	30	0.477778	0.197917	0.937500	0.119048	false	L1_short	drop_stop	balanced	mid_regularity	q2	150	0.192894	0.250000	true
ecoli	lcl|U00096.3_cds_ABP93440.1_1147	ATGAGTTATTCCTCATTTAAGATTATTCTCATTCACGTAAAAAACATAATTCCTATCATCACAGCCACGCTCATTTTGAATTATCTGAATAATAGCGAGCGTTCTTTAGTTAAGCAGATCTTAATTGAAGACGAAATTATTGTGTGTGCAACTTACTTAATACCGGACATCTAA	ATG AGT TAT TCC TCA TTT AAG ATT ATT CTC ATT CAC GTA AAA AAC ATA ATT CCT ATC ATC ACA GCC ACG CTC ATT TTG AAT TAT CTG AAT AAT AGC GAG CGT TCT TTA GTT AAG CAG ATC TTA ATT GAA GAC GAA ATT ATT GTG TGT GCA ACT TAC TTA ATA CCG GAC ATC	57	0.327485	0.328125	0.890625	0.166071	false	L1_short	drop_stop	balanced	high_regularity	q4	150	0.192894	0.250000	true
ecoli	lcl|U00096.3_cds_ABP93442.1_1228	ATGAAGCGGAGTAGAACGGAAGTGGGGCGCTGGCGCATGCAGCGTCAGGCTAGCCGACGTAAATCGCGTTGGCTTGAGGGGCAATCGCGCCGAAATATGCGTATCCACAGCATCAGGAAGTGCATTCTAAACAAACAGCGTAACTCGTTATTGTTTGCGATCTACAATATCTAA	ATG AAG CGG AGT AGA ACG GAA GTG GGG CGC TGG CGC ATG CAG CGT CAG GCT AGC CGA CGT AAA TCG CGT TGG CTT GAG GGG CAA TCG CGC CGA AAT ATG CGT ATC CAC AGC ATC AGG AAG TGC ATT CTA AAC AAA CAG CGT AAC TCG TTA TTG TTT GCG ATC TAC AAT ATC	57	0.514620	0.296875	0.921875	0.119048	false	L1_short	drop_stop	balanced	high_regularity	q4	150	0.192894	0.250000	true
ecoli	lcl|U00096.3_cds_ABP93443.1_1267	ATGTCTGAATTTGATGCCCAGCGCGTTGCCGAACGTATTGATATTGTGTTAGATATCCTTGTGGCAGGCGATTACCACTCTGCGATCCATAATCTCGAGATACTTAAAGCAGAACTCTTGCGCCAGGTTGCTGAATCTACGCCAGACATCCCGAAGGCACCGTGGGAGATTTAA	ATG TCT GAA TTT GAT GCC CAG CGC GTT GCC GAA CGT ATT GAT ATT GTG TTA GAT ATC CTT GTG GCA GGC GAT TAC CAC TCT GCG ATC CAT AAT CTC GAG ATA CTT AAA GCA GAA CTC TTG CGC CAG GTT GCT GAA TCT ACG CCA GAC ATC CCG AAG GCA CCG TGG GAG ATT	57	0.485380	0.281250	0.953125	0.074405	false	L1_short	drop_stop	balanced	high_regularity	q4	150	0.192894	0.250000	true
ecoli	lcl|U00096.3_cds_ACO59989.1_70	ATGCGTCAGTTTTATCAGCACTATTTTACCGCGACAGCGAAGTTGTGCTGGTTGCGTTGGTTAAGCGTCCCACAACGATTAACCATGCTTGAAGGACTGATGCAGTGGGATGACCGCAATTCTGAAAGTTGA	ATG CGT CAG TTT TAT CAG CAC TAT TTT ACC GCG ACA GCG AAG TTG TGC TGG TTG CGT TGG TTA AGC GTC CCA CAA CGA TTA ACC ATG CTT GAA GGA CTG ATG CAG TGG GAT GAC CGC AAT TCT GAA AGT	43	0.472868	0.222222	0.916667	0.079365	false	L1_short	drop_stop	balanced	mid_regularity	q3	150	0.192894	0.250000	true
ecoli	lcl|U00096.3_cds_ACO59990.1_294	ATGAAAGAGAATAAAGTACAGCAAATCAGTCATAAACTGATTAATATCGTTGTTTTTGTCGCAATTGTAGAATACGCCTATTTATTTCTCCATTTCTATTAA	ATG AAA GAG AAT AAA GTA CAG CAA ATC AGT CAT AAA CTG ATT AAT ATC GTT GTT TTT GTC GCA ATT GTA GAA TAC GCC TAT TTA TTT CTC CAT TTC TAT	33	0.292929	0.375000	0.925000	0.261905	false	L1_short	drop_stop	balanced	high_regularity	q4	150	0.192894	0.250000	true
ecoli	lcl|U00096.3_cds_AHA50631.1_793	ATGAATGAGTTCAAGAGGTGTATGCGCGTGTTTAGTCATTCTCCCTTTAAAGTACGGTTAATGCTGCTCTCTATGTTGTGCGATATGGTCAACAACAAACCGCAGCAAGATAAACCTTCCGATAAATAG	ATG AAT GAG TTC AAG AGG TGT ATG CGC GTG TTT AGT CAT TCT CCC TTT AAA GTA CGG TTA ATG CTG CTC TCT ATG TTG TGC GAT ATG GTC AAC AAC AAA CCG CAG CAA GAT AAA CCT TCC GAT AAA	42	0.412698	0.270833	0.895833	0.111111	false	L1_short	drop_stop	balanced	high_regularity	q4	150	0.192894	0.250000	true
ecoli	lcl|U00096.3_cds_AYC08171.1_268	ATGAGAATGATTGGCCTTCTTTATGATTTTAAGGATTATGCTTCTAAAATGGCGGAGAACATGGCGAGGCTTGCTGCCTTACTTCATTACTTCAGCGGTGATGGAGGCGATATATCTGTTACCGGGTAA	ATG AGA ATG ATT GGC CTT CTT TAT GAT TTT AAG GAT TAT GCT TCT AAA ATG GCG GAG AAC ATG GCG AGG CTT GCT GCC TTA CTT CAT TAC TTC AGC GGT GAT GGA GGC GAT ATA TCT GTT ACC GGG	42	0.436508	0.270833	0.875000	0.166667	false	L1_short	drop_stop	balanced	high_regularity	q4	150	0.192894	0.250000	true
ecoli	lcl|U00096.3_cds_AYC08182.1_531	ATGAGCCTCGTTTTATGCTTTTTGTTAATGTCTTTATTTTTTATGTATTCTTTTGTGCTTTCAAGATTATGGCGTAAGAAAATTGCAATACGATTATTGTTGTATATTCAAGATAATGTGACCTTAATTGTCTTTTTAAATAAAAAATAA	ATG AGC CTC GTT TTA TGC TTT TTG TTA ATG TCT TTA TTT TTT ATG TAT TCT TTT GTG CTT TCA AGA TTA TGG CGT AAG AAA ATT GCA ATA CGA TTA TTG TTG TAT ATT CAA GAT AAT GTG ACC TTA ATT GTC TTT TTA AAT AAA AAA	49	0.251701	0.303571	0.910714	0.108844	false	L1_short	drop_stop	balanced	high_regularity	q4	150	0.192894	0.250000	true
ecoli	lcl|U00096.3_cds_AYC08184.1_554	ATGCTGCCGCAGCATAGCGATATTGAAATAGCCTGGTATGCTTCAATACAGCAGGAGCCGAATGGCTGGAAGACCGTCACCACACAGTTCTACATCCAGGAATTCAGTGAGTATATTGCGCCACTGCAGGATGCTGTAGATCTGGAAATCGCAACGGAGGAAGAAAGATCGTTGCTGGAAGCCTGA	ATG CTG CCG CAG CAT AGC GAT ATT GAA ATA GCC TGG TAT GCT TCA ATA CAG CAG GAG CCG AAT GGC TGG AAG ACC GTC ACC ACA CAG TTC TAC ATC CAG GAA TTC AGT GAG TAT ATT GCG CCA CTG CAG GAT GCT GTA GAT CTG GAA ATC GCA ACG GAG GAA GAA AGA TCG TTG CTG GAA GCC	61	0.497268	0.228125	0.890625	0.224107	false	L1_short	drop_stop	balanced	mid_regularity	q3	150	0.192894	0.250000	true
ecoli	lcl|U00096.3_cds_AYC08187.1_702	ATGCGTAAAAGTTATGAAGTCGGTATTTCACCTAAGATTAACTTATGTAACAGTGTGGAAGTATTGACCAATTCATTCGGGACAGTTATTAGTGGTAGACAAGTTTAA	ATG CGT AAA AGT TAT GAA GTC GGT ATT TCA CCT AAG ATT AAC TTA TGT AAC AGT GTG GAA GTA TTG ACC AAT TCA TTC GGG ACA GTT ATT AGT GGT AGA CAA GTT	35	0.352381	0.191667	0.975000	0.114286	false	L1_short	drop_stop	balanced	low_regularity	q1	150	0.192894	0.250000	true
ecoli	lcl|U00096.3_cds_AYC08195.1_1135	ATGGAAATAAAAGTGCAGAGACTATCTCTATGGATGATTAATACTGTCTTTTTATTGTCACCCATAAATAATCACCAGACTAATACTATCAACTTGATATTTGAAATGTGA	ATG GAA ATA AAA GTG CAG AGA CTA TCT CTA TGG ATG ATT AAT ACT GTC TTT TTA TTG TCA CCC ATA AAT AAT CAC CAG ACT AAT ACT ATC AAC TTG ATA TTT GAA ATG	36	0.296296	0.200000	0.950000	0.242857	false	L1_short	drop_stop	balanced	mid_regularity	q2	150	0.192894	0.250000	true
ecoli	lcl|U00096.3_cds_AYC08199.1_1257	ATGATCAACACAAATATGAAATATTGGTCCTGGATGGGCGCGTTTTCTCTGTCGATGCTCTTCTGGGCCGAACTCCTCTGGATCATTACTCACTGA	ATG ATC AAC ACA AAT ATG AAA TAT TGG TCC TGG ATG GGC GCG TTT TCT CTG TCG ATG CTC TTC TGG GCC GAA CTC CTC TGG ATC ATT ACT CAC	31	0.462366	0.227679	0.901786	0.177381	false	L1_short	drop_stop	balanced	mid_regularity	q3	150	0.192894	0.250000	true
