species	seq_id	cds_nt	codon_tokens	num_codons	gc_content	dominant_reference_coverage	avg_window_heterogeneity	sparse_difference_ratio	has_internal_stop	length_group	terminal_stop_policy	sampling_view	regularity_group	regularity_quartile	regularity_bin_n	regularity_q1	regularity_q3	regularity_is_reportable
scerevisiae	lcl|BK006938.2_cds_DAA11795.1_856	ATGGCTCACGAAAACGTTTGGTTCTCCCACCCAAGAAGATTCGGTAAAGGTTCCCGTCAATGTCGTGTCTGCTCCTCCCACACTGGTTTGGTCAGAAAGTACGACTTAAACATCTGTCGTCAATGTTTCAGAGAAAAGGCTAACGACATTGGTTTCCACAAGTACAGATAA	ATG GCT CAC GAA AAC GTT TGG TTC TCC CAC CCA AGA AGA TTC GGT AAA GGT TCC CGT CAA TGT CGT GTC TGC TCC TCC CAC ACT GGT TTG GTC AGA AAG TAC GAC TTA AAC ATC TGT CGT CAA TGT TTC AGA GAA AAG GCT AAC GAC ATT GGT TTC CAC AAG TAC AGA	56	0.458333	0.178571	0.946429	0.193878	false	L1_short	drop_stop	balanced	low_regularity	q1	150	0.192150	0.252371	true
scerevisiae	lcl|BK006938.2_cds_DAA11851.1_914	ATGACTTGCGGTATAGAAAATAGTTATAAGAGTGCTGAAAAAAAAAAGAAGTACAGAAGTTTTCGTTTCTTTGAAAGTCGCGATTATTCCGAGTTGTGTATTATAGTAGGAACATACTATTGA	ATG ACT TGC GGT ATA GAA AAT AGT TAT AAG AGT GCT GAA AAA AAA AAG AAG TAC AGA AGT TTT CGT TTC TTT GAA AGT CGC GAT TAT TCC GAG TTG TGT ATT ATA GTA GGA ACA TAC TAT	40	0.316667	0.175000	0.925000	0.219048	false	L1_short	drop_stop	balanced	low_regularity	q1	150	0.192150	0.252371	true
scerevisiae	lcl|BK006938.2_cds_DAA11882.1_947	ATGAGGCATCATCAAAATATGCATTATGCCCCACAACAACAACCAGTCTATGTCCAACAGCCTCCTCCTCGGAGAGAATCCGGTGGTTGCTGTAGAACCTGTTGTCACTTCCTATGTTGTCTATGTTTAATTAACCTATGTTGTGACGTTTTTTAA	ATG AGG CAT CAT CAA AAT ATG CAT TAT GCC CCA CAA CAA CAA CCA GTC TAT GTC CAA CAG CCT CCT CCT CGG AGA GAA TCC GGT GGT TGC TGT AGA ACC TGT TGT CAC TTC CTA TGT TGT CTA TGT TTA ATT AAC CTA TGT TGT GAC GTT TTT	51	0.424837	0.369048	0.714286	0.114286	false	L1_short	drop_stop	balanced	high_regularity	q4	150	0.192150	0.252371	true
scerevisiae	lcl|BK006938.2_cds_DAA11926.1_991	ATGGCTAGAGCAAGAAAGGGTGCACTGGTTCAATGTGATCCATCCATCAAGGCGCTCATATTACAAATTGACGCCAAGATGAGTGATATAGTACTAGAGGAGTTGGATGACACCCATCTTTTAGTAAATCCCTCGAAAGTCGAATTTGTTAAGCATGAGCTAAATAGGCTATTATCTAAGAATATATATAATCCTATGGATGAAGAAGAAAATCAGTAA	ATG GCT AGA GCA AGA AAG GGT GCA CTG GTT CAA TGT GAT CCA TCC ATC AAG GCG CTC ATA TTA CAA ATT GAC GCC AAG ATG AGT GAT ATA GTA CTA GAG GAG TTG GAT GAC ACC CAT CTT TTA GTA AAT CCC TCG AAA GTC GAA TTT GTT AAG CAT GAG CTA AAT AGG CTA TTA TCT AAG AAT ATA TAT AAT CCT ATG GAT GAA GAA GAA AAT CAG	72	0.379630	0.194444	0.916667	0.191534	false	L1_short	drop_stop	balanced	mid_regularity	q2	150	0.192150	0.252371	true
scerevisiae	lcl|BK006938.2_cds_DAA11965.1_1031	ATGTTCTTCAGCCAAGTTTTGAGATCTTCCGCTCGTGCTGCCCCAATCAAGAGGTATACAGGCGGTAGAATAGGTGAATCGTGGGTAATTACGGAAGGTAGAAGGCTCATTCCAGAAATCTTTCAATGGAGTGCAGTATTGAGCGTTTGTTTAGGTTGGCCTGGTGCTGTATACTTCTTTAGTAAGGCAAGAAAAGCATGA	ATG TTC TTC AGC CAA GTT TTG AGA TCT TCC GCT CGT GCT GCC CCA ATC AAG AGG TAT ACA GGC GGT AGA ATA GGT GAA TCG TGG GTA ATT ACG GAA GGT AGA AGG CTC ATT CCA GAA ATC TTT CAA TGG AGT GCA GTA TTG AGC GTT TGT TTA GGT TGG CCT GGT GCT GTA TAC TTC TTT AGT AAG GCA AGA AAA GCA	66	0.444444	0.222222	0.944444	0.177249	false	L1_short	drop_stop	balanced	mid_regularity	q3	150	0.192150	0.252371	true
scerevisiae	lcl|BK006938.2_cds_DAA12010.1_1078	ATGATGAGAATGTCTCTAAAACAAATGCAGTCACAGAGATTTTCTGCGACTTCTCGAGTGAGAATGTTGCTTATTGGTGCTAGTGGCTTGAGATCTTCGTCAAGCAAATTGGAATGCCCCAGATTCTCAAACAAGCACGGCAGAAACTGA	ATG ATG AGA ATG TCT CTA AAA CAA ATG CAG TCA CAG AGA TTT TCT GCG ACT TCT CGA GTG AGA ATG TTG CTT ATT GGT GCT AGT GGC TTG AGA TCT TCG TCA AGC AAA TTG GAA TGC CCC AGA TTC TCA AAC AAG CAC GGC AGA AAC	49	0.428571	0.321429	0.928571	0.061224	false	L1_short	drop_stop	balanced	high_regularity	q4	150	0.192150	0.252371	true
scerevisiae	lcl|BK006938.2_cds_DAA12037.1_1105	ATGAAACAGATGATGATTGAAGCATCCATAAGTAAAGACACTTTGAGGTTGCTAATTTGCTTTTTTGAAATAAAACAGTGCCATATATCACTCCAGCCTACTTGTTATTATCAGAATTGGGTACGGTATTCATCTATATATTACCAGTTGTAA	ATG AAA CAG ATG ATG ATT GAA GCA TCC ATA AGT AAA GAC ACT TTG AGG TTG CTA ATT TGC TTT TTT GAA ATA AAA CAG TGC CAT ATA TCA CTC CAG CCT ACT TGT TAT TAT CAG AAT TGG GTA CGG TAT TCA TCT ATA TAT TAC CAG TTG	50	0.333333	0.285714	0.892857	0.215646	false	L1_short	drop_stop	balanced	high_regularity	q4	150	0.192150	0.252371	true
scerevisiae	lcl|BK006938.2_cds_DAA12050.1_1119	ATGAGCCAACAACAAGGTTACTACCAACAAGGACCCCCACAGCAAGGTTATTATCAACAAGGTCCACCACAACAAGGTTATTATCAACAAGGTCCACCGCAACAGGGTTATCCTCAGCAGCAACCAGTCTATGTCCAACAAGGTCAACCAAAGGAGGAAAGCTGCTTGGACAGTTGTTTAAAATGTTTGTGTTGTTGTTTCTTATTAGAATTGGTATGCGATAACTGA	ATG AGC CAA CAA CAA GGT TAC TAC CAA CAA GGA CCC CCA CAG CAA GGT TAT TAT CAA CAA GGT CCA CCA CAA CAA GGT TAT TAT CAA CAA GGT CCA CCG CAA CAG GGT TAT CCT CAG CAG CAA CCA GTC TAT GTC CAA CAA GGT CAA CCA AAG GAG GAA AGC TGC TTG GAC AGT TGT TTA AAA TGT TTG TGT TGT TGT TTC TTA TTA GAA TTG GTA TGC GAT AAC	75	0.426667	0.333333	0.725000	0.194286	false	L1_short	drop_stop	balanced	high_regularity	q4	150	0.192150	0.252371	true
scerevisiae	lcl|BK006938.2_cds_DAA12087.1_1157	ATGCGCCGCCTATATCGTCATCTTGCTTCCTTTTTCTTACTCCCTTCCTGCCCTGGAAACACCATACAATCCATCACATCATATCCTGCCAATGCACTATTACGCAGCTTTCGGCACGTGAGTACGGAAACACCAGTTCGGAACCGGGTACACAATAGGGATAGTCAAAGCTGTCCATTTTTTCCGCTGATGGATGACTGA	ATG CGC CGC CTA TAT CGT CAT CTT GCT TCC TTT TTC TTA CTC CCT TCC TGC CCT GGA AAC ACC ATA CAA TCC ATC ACA TCA TAT CCT GCC AAT GCA CTA TTA CGC AGC TTT CGG CAC GTG AGT ACG GAA ACA CCA GTT CGG AAC CGG GTA CAC AAT AGG GAT AGT CAA AGC TGT CCA TTT TTT CCG CTG ATG GAT GAC	66	0.479798	0.208333	0.958333	0.246032	false	L1_short	drop_stop	balanced	mid_regularity	q2	150	0.192150	0.252371	true
scerevisiae	lcl|BK006938.2_cds_DAA12117.1_1188	ATGGATTCTGCCAAGATCATTAACATTATATTATCCCTTTTCTTACCACCAGTCGCCGTTTTTCTAGCCCGTGGGTGGGGTACTGACTGTATAGTGGATATCATTTTGACCATTTTGGCTTGGTTCCCAGGTATGCTATATGCCTTGTACATTGTCCTACAAGATTAA	ATG GAT TCT GCC AAG ATC ATT AAC ATT ATA TTA TCC CTT TTC TTA CCA CCA GTC GCC GTT TTT CTA GCC CGT GGG TGG GGT ACT GAC TGT ATA GTG GAT ATC ATT TTG ACC ATT TTG GCT TGG TTC CCA GGT ATG CTA TAT GCC TTG TAC ATT GTC CTA CAA GAT	55	0.418182	0.181122	0.928571	0.136054	false	L1_short	drop_stop	balanced	low_regularity	q1	150	0.192150	0.252371	true
scerevisiae	lcl|BK006938.2_cds_DAA12162.1_1233	ATGGAGAACCCTCATGAACAAGTGCAGGCTAACATACTTTCGCGAATAATTGGTAATGTCAAAAGGCTCAATGAGAGCGTGGCAATTCTTAACCAGGAGCTTGTGACCATTAATAATCGGAACAAAAATCTAGAAATCATGGGCGCAATTTGTGATAACTACCATAGTAGCGTCCAATTCAACCTGGAAGCGACCAATAACAAGAAGCCACCTCTTTAA	ATG GAG AAC CCT CAT GAA CAA GTG CAG GCT AAC ATA CTT TCG CGA ATA ATT GGT AAT GTC AAA AGG CTC AAT GAG AGC GTG GCA ATT CTT AAC CAG GAG CTT GTG ACC ATT AAT AAT CGG AAC AAA AAT CTA GAA ATC ATG GGC GCA ATT TGT GAT AAC TAC CAT AGT AGC GTC CAA TTC AAC CTG GAA GCG ACC AAT AAC AAG AAG CCA CCT CTT	72	0.416667	0.180556	0.944444	0.187831	false	L1_short	drop_stop	balanced	low_regularity	q1	150	0.192150	0.252371	true
scerevisiae	lcl|BK006938.2_cds_DAA12222.1_1294	ATGCCTAAGAGATTAAGTGGGTTACAAAAAGAAGTCTTACACCTGTATAGGGCTTCCATACGAACGGCTCATACAAAACCAAAGGAAAACCAAGTTAATTTTGTGAATTATATTCATGAAGAATTTGGGAAGTATAGAAATTTGCCAAGAAAAGACTTCACCACCATTGAACACTTGTTACGGGTCGGAAACAAAAAAATTGCCACCTTTTCACACCCTGAACTGACGAATATACATTGA	ATG CCT AAG AGA TTA AGT GGG TTA CAA AAA GAA GTC TTA CAC CTG TAT AGG GCT TCC ATA CGA ACG GCT CAT ACA AAA CCA AAG GAA AAC CAA GTT AAT TTT GTG AAT TAT ATT CAT GAA GAA TTT GGG AAG TAT AGA AAT TTG CCA AGA AAA GAC TTC ACC ACC ATT GAA CAC TTG TTA CGG GTC GGA AAC AAA AAA ATT GCC ACC TTT TCA CAC CCT GAA CTG ACG AAT ATA CAT	79	0.367089	0.189286	0.937500	0.195238	false	L1_short	drop_stop	balanced	low_regularity	q1	150	0.192150	0.252371	true
scerevisiae	lcl|BK006939.2_cds_DAA07595.1_1464	ATGGCGCCTCCAACCACCATCCGCACTAGGGACCAAGCGCTCGCACCGTTAGCAACGCTTGACTCACAAACCAACTGCCGGCTGAAAGAGCTTGTGCAATGGGAGTGCCAATTCAAAGGAGCCGAATACGTCTGCTCGCCTTTTAAGAGGCTTTTTGAACACTGCATTGCACCCGACAAATCAGCCACTAACTACGAGGTCACGGACACATATACCAATAGTTAA	ATG GCG CCT CCA ACC ACC ATC CGC ACT AGG GAC CAA GCG CTC GCA CCG TTA GCA ACG CTT GAC TCA CAA ACC AAC TGC CGG CTG AAA GAG CTT GTG CAA TGG GAG TGC CAA TTC AAA GGA GCC GAA TAC GTC TGC TCG CCT TTT AAG AGG CTT TTT GAA CAC TGC ATT GCA CCC GAC AAA TCA GCC ACT AAC TAC GAG GTC ACG GAC ACA TAT ACC AAT AGT	74	0.518018	0.187500	0.975000	0.219048	false	L1_short	drop_stop	balanced	low_regularity	q1	150	0.192150	0.252371	true
scerevisiae	lcl|BK006939.2_cds_DAA07636.1_1507	ATGTTGATGAGCACGTTACCAGGTGGTGTTATCTTAGTTTTTATTCTAGTCGGTTTGGCTTGTATCGCCATCATTTCTACCATTATCTACAGAAAATGGCAAGCTAGACAAAGAGGTTTACAAAGATTCTAA	ATG TTG ATG AGC ACG TTA CCA GGT GGT GTT ATC TTA GTT TTT ATT CTA GTC GGT TTG GCT TGT ATC GCC ATC ATT TCT ACC ATT ATC TAC AGA AAA TGG CAA GCT AGA CAA AGA GGT TTA CAA AGA TTC	43	0.379845	0.263889	0.875000	0.194444	false	L1_short	drop_stop	balanced	high_regularity	q4	150	0.192150	0.252371	true
scerevisiae	lcl|BK006939.2_cds_DAA07693.1_1568	ATGAGCAAGCATAAGCATGAATGGACGGAATCAGTGGCCAACTCTGGGCCGGCTTCAATCTTATCTTACTGCGCGTCCTCGATTTTGATGACAGTAACGAACAAATTCGTGGTTAACCTGGACAACTTTAACATGAACTTTGTGATGTTGTTTGTACAATCACTGGTGTGCACTGTGACGCTATGTATCCTACGAATTGTAGGCGTTGCTAATTTTTGA	ATG AGC AAG CAT AAG CAT GAA TGG ACG GAA TCA GTG GCC AAC TCT GGG CCG GCT TCA ATC TTA TCT TAC TGC GCG TCC TCG ATT TTG ATG ACA GTA ACG AAC AAA TTC GTG GTT AAC CTG GAC AAC TTT AAC ATG AAC TTT GTG ATG TTG TTT GTA CAA TCA CTG GTG TGC ACT GTG ACG CTA TGT ATC CTA CGA ATT GTA GGC GTT GCT AAT TTT	72	0.430556	0.194444	0.902778	0.122751	false	L1_short	drop_stop	balanced	mid_regularity	q2	150	0.192150	0.252371	true
scerevisiae	lcl|BK006939.2_cds_DAA07739.1_1614	ATGGTGCGGCTTTCGTATCTGCGTCTCATCCTTCCCCCTTGCCGCTTGTCAGAACTCTCTAGCTTGGCGATTCTCTATCAACCTGTTATTCCAATTCTTATATCTACCATTACCTTCCAGCATTTTTTCAAATGTGTTCACACGCCCTGTAACGTTTATATATAA	ATG GTG CGG CTT TCG TAT CTG CGT CTC ATC CTT CCC CCT TGC CGC TTG TCA GAA CTC TCT AGC TTG GCG ATT CTC TAT CAA CCT GTT ATT CCA ATT CTT ATA TCT ACC ATT ACC TTC CAG CAT TTT TTC AAA TGT GTT CAC ACG CCC TGT AAC GTT TAT ATA	54	0.432099	0.166667	0.964286	0.085034	false	L1_short	drop_stop	balanced	low_regularity	q1	150	0.192150	0.252371	true
scerevisiae	lcl|BK006939.2_cds_DAA07799.1_1676	ATGATAATAATATTTATAGAATTGTGTAGAATTGCAGATTCCCTTTTATGGATTCCTAAATCCTCGAGGAGAACTTCTAGTATATCTACATACCTAATATTATAA	ATG ATA ATA ATA TTT ATA GAA TTG TGT AGA ATT GCA GAT TCC CTT TTA TGG ATT CCT AAA TCC TCG AGG AGA ACT TCT AGT ATA TCT ACA TAC CTA ATA TTA	34	0.284314	0.300000	0.900000	0.311905	false	L1_short	drop_stop	balanced	high_regularity	q4	150	0.192150	0.252371	true
scerevisiae	lcl|BK006939.2_cds_DAA07838.1_1716	ATGAGACTACATAAAACATTTATCTGTTTTAGTCAAAACAAACGTGGTTGTAGAAATATTCTGCAAGAAAATTCGCGGATGATATTTGAGAATAAAATACTCATAATGATATTGAGGCAGGGTATATTTTTTAATATTAGCGTGAGCACCAAGATCAGTTTCTAA	ATG AGA CTA CAT AAA ACA TTT ATC TGT TTT AGT CAA AAC AAA CGT GGT TGT AGA AAT ATT CTG CAA GAA AAT TCG CGG ATG ATA TTT GAG AAT AAA ATA CTC ATA ATG ATA TTG AGG CAG GGT ATA TTT TTT AAT ATT AGC GTG AGC ACC AAG ATC AGT TTC	54	0.308642	0.202381	0.928571	0.198639	false	L1_short	drop_stop	balanced	mid_regularity	q2	150	0.192150	0.252371	true
scerevisiae	lcl|BK006940.2_cds_DAA12398.1_1758	ATGAAAATGTGGGGACCCTCCCAACGAGATTCCTTCAGAGAGATTACATATAAAGTGAAATTCAAGTATGACGATGGTGACTACTCCTTGGCCATTGATTTGATGTCTAGGGATTGTATTAATGTCTATGAGTTGATTACCGATAGGCTACTGGTTGATTTCCTTTCAAAAAAGCTGCTCAAGCTAAGATAG	ATG AAA ATG TGG GGA CCC TCC CAA CGA GAT TCC TTC AGA GAG ATT ACA TAT AAA GTG AAA TTC AAG TAT GAC GAT GGT GAC TAC TCC TTG GCC ATT GAT TTG ATG TCT AGG GAT TGT ATT AAT GTC TAT GAG TTG ATT ACC GAT AGG CTA CTG GTT GAT TTC CTT TCA AAA AAG CTG CTC AAG CTA AGA	63	0.391534	0.191964	0.919643	0.117262	false	L1_short	drop_stop	balanced	low_regularity	q1	150	0.192150	0.252371	true
scerevisiae	lcl|BK006940.2_cds_DAA12474.1_1837	ATGGCTAAGTCTAAGAACCATACCGCTCACAACCAAACCAGAAAGGCTCACAGAAACGGTATCAAGAAGCCAAAGACCTACAAGTACCCTTCTTTGAAAGGTGTTGATCCAAAGTTTAGAAGAAACCACAAGCATGCCCTACACGGCACTGCTAAGGCTTTGGCTGCTGCCAAGAAATAA	ATG GCT AAG TCT AAG AAC CAT ACC GCT CAC AAC CAA ACC AGA AAG GCT CAC AGA AAC GGT ATC AAG AAG CCA AAG ACC TAC AAG TAC CCT TCT TTG AAA GGT GTT GAT CCA AAG TTT AGA AGA AAC CAC AAG CAT GCC CTA CAC GGC ACT GCT AAG GCT TTG GCT GCT GCC AAG AAA	59	0.457627	0.276042	0.859375	0.233631	false	L1_short	drop_stop	balanced	high_regularity	q4	150	0.192150	0.252371	true
scerevisiae	lcl|BK006941.2_cds_DAA07858.1_1867	ATGGAGATGCTCTTGTTTCTGAACGAATCATACATCTTTCATAGACTTCGTATGTGGAGTATTGTATTATGGCACTCATGTGTATTCGTATGCGCAGAATGTGGGAATGCCAATTATAGGGTGCCGAGGTGCCTTATAAAACCCTTTTCTGTGCCTGTGACATTTCCTTTTTCGGTCAAAAAGAATATCCGAATTTTAGATTTGGACCCTCGTACAGAAGCTTATTGTTAA	ATG GAG ATG CTC TTG TTT CTG AAC GAA TCA TAC ATC TTT CAT AGA CTT CGT ATG TGG AGT ATT GTA TTA TGG CAC TCA TGT GTA TTC GTA TGC GCA GAA TGT GGG AAT GCC AAT TAT AGG GTG CCG AGG TGC CTT ATA AAA CCC TTT TCT GTG CCT GTG ACA TTT CCT TTT TCG GTC AAA AAG AAT ATC CGA ATT TTA GAT TTG GAC CCT CGT ACA GAA GCT TAT TGT	76	0.399123	0.200000	0.912500	0.126190	false	L1_short	drop_stop	balanced	mid_regularity	q2	150	0.192150	0.252371	true
scerevisiae	lcl|BK006941.2_cds_DAA07860.1_1869	ATGGCATTTGAAAGACAAGGAAAGATCGAAAAGAAGATATCGTATTCCTTATTTTTGAATGGACCTAATGTACACTTTGGGAGCATCTTATTCGGTGCAGTCGATAAAAGTAAGTACGCAGAAGAGCTCTGCACACATCCTATGCGTCAAGCTTATAATACCCTTGATTCAAACTCAAGAATAATTATCACAGTACAGAGTGTTGCAATTTTGGACGGCAAACTTGTATGGTAA	ATG GCA TTT GAA AGA CAA GGA AAG ATC GAA AAG AAG ATA TCG TAT TCC TTA TTT TTG AAT GGA CCT AAT GTA CAC TTT GGG AGC ATC TTA TTC GGT GCA GTC GAT AAA AGT AAG TAC GCA GAA GAG CTC TGC ACA CAT CCT ATG CGT CAA GCT TAT AAT ACC CTT GAT TCA AAC TCA AGA ATA ATT ATC ACA GTA CAG AGT GTT GCA ATT TTG GAC GGC AAA CTT GTA TGG	77	0.380952	0.182500	0.950000	0.088095	false	L1_short	drop_stop	balanced	low_regularity	q1	150	0.192150	0.252371	true
scerevisiae	lcl|BK006941.2_cds_DAA07927.1_1937	ATGTTAACGACACAAAAGTGTGAAAGTAGAGAAGGGAAGAACGATGAGATCTTTGAATTGGGAGAAAGTAATAGTGACAAGATATTATTAAAACATGGCAAATGTAACTTGTTTTCTGAAAGGAAACCAGTTAATCACTAG	ATG TTA ACG ACA CAA AAG TGT GAA AGT AGA GAA GGG AAG AAC GAT GAG ATC TTT GAA TTG GGA GAA AGT AAT AGT GAC AAG ATA TTA TTA AAA CAT GGC AAA TGT AAC TTG TTT TCT GAA AGG AAA CCA GTT AAT CAC	46	0.333333	0.173611	0.958333	0.207937	false	L1_short	drop_stop	balanced	low_regularity	q1	150	0.192150	0.252371	true
scerevisiae	lcl|BK006941.2_cds_DAA08058.1_2071	ATGTTCGATAGTTCTATCGAACGAGTGACTCTGGAACTATGCTTCCATATAACTCTTAGCATTATGTGTGGCTGTAGTATCTACTTTCTGCTTCTTGTGTTTATTCTAACTTTTTATTCGTCGGTTTTGTTACATCTTAAATTGTATTTCTTTAGTTCTGACCGAGCCATATTTAATGCATAG	ATG TTC GAT AGT TCT ATC GAA CGA GTG ACT CTG GAA CTA TGC TTC CAT ATA ACT CTT AGC ATT ATG TGT GGC TGT AGT ATC TAC TTT CTG CTT CTT GTG TTT ATT CTA ACT TTT TAT TCG TCG GTT TTG TTA CAT CTT AAA TTG TAT TTC TTT AGT TCT GAC CGA GCC ATA TTT AAT GCA	60	0.344444	0.187500	0.953125	0.142857	false	L1_short	drop_stop	balanced	low_regularity	q1	150	0.192150	0.252371	true
scerevisiae	lcl|BK006941.2_cds_DAA08133.1_2151	ATGTTGCTATATTTATATATTTTATATATTGCCCTCAAAACTGTATCTCATCTTTTTTTCTGCAATCCTTGCTTTCGTAATCTAAGTGTGGGTGACATGCTAAATCCGCGGCTTTCCTTAAGCTTTTTCACAAACCATCTATTATGTCCAGAAGCTCCGCTGATTATCCGTGGAAAAGGGTCTTATTCTGCCGTAGGAAACTTCTTCTCGAGAAAAAAGTGA	ATG TTG CTA TAT TTA TAT ATT TTA TAT ATT GCC CTC AAA ACT GTA TCT CAT CTT TTT TTC TGC AAT CCT TGC TTT CGT AAT CTA AGT GTG GGT GAC ATG CTA AAT CCG CGG CTT TCC TTA AGC TTT TTC ACA AAC CAT CTA TTA TGT CCA GAA GCT CCG CTG ATT ATC CGT GGA AAA GGG TCT TAT TCT GCC GTA GGA AAC TTC TTC TCG AGA AAA AAG	73	0.374429	0.262500	0.937500	0.076190	false	L1_short	drop_stop	balanced	high_regularity	q4	150	0.192150	0.252371	true
scerevisiae	lcl|BK006941.2_cds_DAA08198.1_2219	ATGGCTGTAGATGTTCCTCGTGCGGTGATTAATAAACTTATGCTGTTTACTGCAGCGATGGTGGTACTGCCCGTACTCACTTTTTTCATTATTCAGCAATTTACGCCAAATACCTTAATTAGTGGAGGTTTAGCTGCTGCAATGGCCAATGTTGTTCTAATCGTTTACATTGTTGTAGCGTTCCGCGAGGATACTGAAGATCACAAAGTTGATGGTAATAAAAAGGAAGACTGA	ATG GCT GTA GAT GTT CCT CGT GCG GTG ATT AAT AAA CTT ATG CTG TTT ACT GCA GCG ATG GTG GTA CTG CCC GTA CTC ACT TTT TTC ATT ATT CAG CAA TTT ACG CCA AAT ACC TTA ATT AGT GGA GGT TTA GCT GCT GCA ATG GCC AAT GTT GTT CTA ATC GTT TAC ATT GTT GTA GCG TTC CGC GAG GAT ACT GAA GAT CAC AAA GTT GAT GGT AAT AAA AAG GAA GAC	77	0.406926	0.195000	0.937500	0.234524	false	L1_short	drop_stop	balanced	mid_regularity	q2	150	0.192150	0.252371	true
scerevisiae	lcl|BK006941.2_cds_DAA08214.1_2235	ATGTCAAGACACAAGTACAAGTTATGGATGTGCATCGCAAAGGGAAAAAGGGGAGTGGGGGAAAGAAATACGTTTGTCCCTAAGTGCTCTTATGCTCCCTTTTGTGCTTCAGAGGTTCTTGATCAATTATTAAGAGGGGATAACTCTATCGTATATAACTTTTATCTTAAAAATGGTTCAGGTAGTGTTTATATAGGCTCAGTCTTTCTTATCTGA	ATG TCA AGA CAC AAG TAC AAG TTA TGG ATG TGC ATC GCA AAG GGA AAA AGG GGA GTG GGG GAA AGA AAT ACG TTT GTC CCT AAG TGC TCT TAT GCT CCC TTT TGT GCT TCA GAG GTT CTT GAT CAA TTA TTA AGA GGG GAT AAC TCT ATC GTA TAT AAC TTT TAT CTT AAA AAT GGT TCA GGT AGT GTT TAT ATA GGC TCA GTC TTT CTT ATC	71	0.380282	0.182540	0.930556	0.126984	false	L1_short	drop_stop	balanced	low_regularity	q1	150	0.192150	0.252371	true
scerevisiae	lcl|BK006941.2_cds_DAA08238.1_2259	ATGGGGTTCCTCCCTGAGTGTAATTTAACGTGTGCTTTCTTATTGCATTCGTTTACATTCCCTATTGCTCATTGCCCTTCTTTCAGTTGGGCATCTTTTTTTTTCACAATTAGGCCGCCCTTTTTTCCCAAATTGGCACTTGTTTGTACGATCTTTAGCTAG	ATG GGG TTC CTC CCT GAG TGT AAT TTA ACG TGT GCT TTC TTA TTG CAT TCG TTT ACA TTC CCT ATT GCT CAT TGC CCT TCT TTC AGT TGG GCA TCT TTT TTT TTC ACA ATT AGG CCG CCC TTT TTT CCC AAA TTG GCA CTT GTT TGT ACG ATC TTT AGC	53	0.408805	0.207143	0.928571	0.190476	false	L1_short	drop_stop	balanced	mid_regularity	q2	150	0.192150	0.252371	true
scerevisiae	lcl|BK006941.2_cds_DAA08277.1_2299	ATGTCTTTTTCATCACTATATAAAACCTTTTTCAAACGAAACGCTGTTTTTGTTGGTACTATCTTTGCAGGTGCCTTTGTTTTCCAAACTGTATTTGATACTGCTATTACTTCATGGTACGAGAATCACAACAAAGGAAAATTATGGAAAGATGTCAAGGCTCGAATAGCTGCAGGCGATGGAGACGACGATGATGAGTAA	ATG TCT TTT TCA TCA CTA TAT AAA ACC TTT TTC AAA CGA AAC GCT GTT TTT GTT GGT ACT ATC TTT GCA GGT GCC TTT GTT TTC CAA ACT GTA TTT GAT ACT GCT ATT ACT TCA TGG TAC GAG AAT CAC AAC AAA GGA AAA TTA TGG AAA GAT GTC AAG GCT CGA ATA GCT GCA GGC GAT GGA GAC GAC GAT GAT GAG	66	0.378788	0.250000	0.888889	0.362434	false	L1_short	drop_stop	balanced	mid_regularity	q3	150	0.192150	0.252371	true
scerevisiae	lcl|BK006941.2_cds_DAA08298.1_2320	ATGCAATGGAACGCTTTTTCCTTTGTGTCTTATGTATATCTTCGTTATTTTATTTCGTTCCGCCCAAATATTGTGCTAGCCAGTGTTCGCTTGTCTTGGTATAGTATCATTTAG	ATG CAA TGG AAC GCT TTT TCC TTT GTG TCT TAT GTA TAT CTT CGT TAT TTT ATT TCG TTC CGC CCA AAT ATT GTG CTA GCC AGT GTT CGC TTG TCT TGG TAT AGT ATC ATT	37	0.369369	0.240000	0.900000	0.156667	false	L1_short	drop_stop	balanced	mid_regularity	q3	150	0.192150	0.252371	true
scerevisiae	lcl|BK006941.2_cds_DAA08332.1_2355	ATGATACTATCCAAACATGTAAATTTTACGTACCATACATATAACCTCATCTATAATTTTTACCCTGATCTAACTAACTTTGGCATGCCTGGTTCAATCTACGGGTTACAGTCATCGTTGAAAACGATGGAAAAACATGTCGAGATTCCTCAATCCATACACCATTATAGTCCGTTTTATCAGCTTCCACTAATTTTTTAA	ATG ATA CTA TCC AAA CAT GTA AAT TTT ACG TAC CAT ACA TAT AAC CTC ATC TAT AAT TTT TAC CCT GAT CTA ACT AAC TTT GGC ATG CCT GGT TCA ATC TAC GGG TTA CAG TCA TCG TTG AAA ACG ATG GAA AAA CAT GTC GAG ATT CCT CAA TCC ATA CAC CAT TAT AGT CCG TTT TAT CAG CTT CCA CTA ATT TTT	66	0.348485	0.180556	0.986111	0.224868	false	L1_short	drop_stop	balanced	low_regularity	q1	150	0.192150	0.252371	true
scerevisiae	lcl|BK006941.2_cds_DAF84567.1_2342	ATGAACGTTCGTGGAAATCAATGCATTATGTCTATAAGAGTATTCCTAAAAGCAGGAGAAAGTTCGCTATCATTTGCCATTAAGTGGCTCAAACGGTTTGAGGCCACTACGAAGAAAAATCAATATATACAAAACGGTTGGCCACTAAAAGATGGAAATAAAAAAAGAAAATAA	ATG AAC GTT CGT GGA AAT CAA TGC ATT ATG TCT ATA AGA GTA TTC CTA AAA GCA GGA GAA AGT TCG CTA TCA TTT GCC ATT AAG TGG CTC AAA CGG TTT GAG GCC ACT ACG AAG AAA AAT CAA TAT ATA CAA AAC GGT TGG CCA CTA AAA GAT GGA AAT AAA AAA AGA AAA	57	0.350877	0.281250	0.953125	0.177976	false	L1_short	drop_stop	balanced	high_regularity	q4	150	0.192150	0.252371	true
scerevisiae	lcl|BK006942.2_cds_DAA08544.1_2867	ATGACTCGTGATACACCCGAAGATGTCAGTACTGCAGGCGCAAAGGATATTTTAGATGTTTTGAACCTACTAAAAGGAGGAGAAGAGAAAATCTCGGAAGTCGAACTTAAGTTGGATGAAATGGAAAAGAAAATGGACTCTCTGTTAGTTCAGTTAGAAGATCTACACAGGGACAACAATGATTTGGCAAAAAGTTCCAGCCAAAAATAG	ATG ACT CGT GAT ACA CCC GAA GAT GTC AGT ACT GCA GGC GCA AAG GAT ATT TTA GAT GTT TTG AAC CTA CTA AAA GGA GGA GAA GAG AAA ATC TCG GAA GTC GAA CTT AAG TTG GAT GAA ATG GAA AAG AAA ATG GAC TCT CTG TTA GTT CAG TTA GAA GAT CTA CAC AGG GAC AAC AAT GAT TTG GCA AAA AGT TCC AGC CAA AAA	69	0.391304	0.244444	0.875000	0.192857	false	L1_short	drop_stop	balanced	mid_regularity	q3	150	0.192150	0.252371	true
scerevisiae	lcl|BK006942.2_cds_DAA08565.1_2888	ATGCCTAGTGATTATACTTCCCATTACCCAGTAATACTTATCAAAAAAAAAAAAAAAAAAATTGCAGGAATGTATAGGCATAGTAAGCGGTACCTTGAGATAATGTCCACCGCTTCAGCTCAATTCGTCGGAAACTAA	ATG CCT AGT GAT TAT ACT TCC CAT TAC CCA GTA ATA CTT ATC AAA AAA AAA AAA AAA AAA ATT GCA GGA ATG TAT AGG CAT AGT AAG CGG TAC CTT GAG ATA ATG TCC ACC GCT TCA GCT CAA TTC GTC GGA AAC	45	0.362963	0.241667	0.895833	0.099206	false	L1_short	drop_stop	balanced	mid_regularity	q3	150	0.192150	0.252371	true
scerevisiae	lcl|BK006942.2_cds_DAA08568.1_2892	ATGTCATTCTCTGTCAGCTGCAAGACTCCCAAGACCACGAAGCTGCTGGTATCTTCTATTTCAGAGAGCGCTGTTGCTCTTATTATTATTACCATACGTATACTTTTTTCCATTGGCAAAAGCGATTTCAAAAAAATAATCTCCAAGGAAATAAATGGTGCAGAAACAATATACTACAGAAATATACCGGAAAGTAAACCCCAAGGGAGTTAG	ATG TCA TTC TCT GTC AGC TGC AAG ACT CCC AAG ACC ACG AAG CTG CTG GTA TCT TCT ATT TCA GAG AGC GCT GTT GCT CTT ATT ATT ATT ACC ATA CGT ATA CTT TTT TCC ATT GGC AAA AGC GAT TTC AAA AAA ATA ATC TCC AAG GAA ATA AAT GGT GCA GAA ACA ATA TAC TAC AGA AAT ATA CCG GAA AGT AAA CCC CAA GGG AGT	70	0.380952	0.245370	0.856481	0.209524	false	L1_short	drop_stop	balanced	mid_regularity	q3	150	0.192150	0.252371	true
scerevisiae	lcl|BK006943.2_cds_DAA08605.1_2930	ATGGTTCAGTACGCTCCCTTTCTATTAGGAAAATTTTCTGATCCGTTATTGGCAATTATGGTAGGCTGTCTCAGCTACTATGTGTACGAAAGGAAAATGGGGCGTCCACAAGGTCATCATTTACACGAGCTCATAAAGAAGCGATGGGACGATCGCAAATAA	ATG GTT CAG TAC GCT CCC TTT CTA TTA GGA AAA TTT TCT GAT CCG TTA TTG GCA ATT ATG GTA GGC TGT CTC AGC TAC TAT GTG TAC GAA AGG AAA ATG GGG CGT CCA CAA GGT CAT CAT TTA CAC GAG CTC ATA AAG AAG CGA TGG GAC GAT CGC AAA	53	0.433962	0.207143	0.928571	0.159864	false	L1_short	drop_stop	balanced	mid_regularity	q2	150	0.192150	0.252371	true
scerevisiae	lcl|BK006943.2_cds_DAA08618.1_2944	ATGGCTGCTCAAAAGTCTTTCAGAATCAAGCAAAAAATGGCTAAGGCTAAGAAGCAAAACAGACCATTGCCACAATGGATCAGATTGAGAACCAACAACACTATCCGTTACAACGCTAAGAGAAGAAACTGGAGAAGAACCAAGATGAACATCTAA	ATG GCT GCT CAA AAG TCT TTC AGA ATC AAG CAA AAA ATG GCT AAG GCT AAG AAG CAA AAC AGA CCA TTG CCA CAA TGG ATC AGA TTG AGA ACC AAC AAC ACT ATC CGT TAC AAC GCT AAG AGA AGA AAC TGG AGA AGA ACC AAG ATG AAC ATC	51	0.405229	0.297619	0.821429	0.238095	false	L1_short	drop_stop	balanced	high_regularity	q4	150	0.192150	0.252371	true
scerevisiae	lcl|BK006943.2_cds_DAA08667.1_2994	ATGATCGCCCAAAGTACCAGATTAGCCGCCGCCGTCTCTTCTTCAGCCGCCTCCGCGGGTGTCTCAAGGATAGCCGCTAGCGCCATGGCCAGCACTATTTTCAAGAGATCTCCGGGCAACTCGTTCAACTCTTTTAAGGAATATAGAGAAAATGCCAAGACATATGGTCCCTTGAGTGCCTCACTAGCTACCAGAAGACACTTGGCTCACGCGCCAAAGTTGTAG	ATG ATC GCC CAA AGT ACC AGA TTA GCC GCC GCC GTC TCT TCT TCA GCC GCC TCC GCG GGT GTC TCA AGG ATA GCC GCT AGC GCC ATG GCC AGC ACT ATT TTC AAG AGA TCT CCG GGC AAC TCG TTC AAC TCT TTT AAG GAA TAT AGA GAA AAT GCC AAG ACA TAT GGT CCC TTG AGT GCC TCA CTA GCT ACC AGA AGA CAC TTG GCT CAC GCG CCA AAG TTG	74	0.522523	0.237500	0.887500	0.145000	false	L1_short	drop_stop	balanced	mid_regularity	q3	150	0.192150	0.252371	true
scerevisiae	lcl|BK006943.2_cds_DAA08674.1_3001	ATGATTTTCTTTTTCAACCAGATCCGTTCAATATTTACAGCTTTGCATACGCCAACTCAACAGATCCAATTATCAAGAAGGGCCTTTTTCCAATTCTTAGGCTATTTGGGTAGTTGTGTTGTGATTTCATTAGCAGCTCAATCGAAATACGTGCAGTAA	ATG ATT TTC TTT TTC AAC CAG ATC CGT TCA ATA TTT ACA GCT TTG CAT ACG CCA ACT CAA CAG ATC CAA TTA TCA AGA AGG GCC TTT TTC CAA TTC TTA GGC TAT TTG GGT AGT TGT GTT GTG ATT TCA TTA GCA GCT CAA TCG AAA TAC GTG CAG	52	0.378205	0.196429	0.946429	0.200680	false	L1_short	drop_stop	balanced	mid_regularity	q2	150	0.192150	0.252371	true
scerevisiae	lcl|BK006943.2_cds_DAA08722.1_3049	ATGCCGATATTGGTTTGGCAACTACCGAAAAGCAAGAAGCTAAAAACTTTGAAGTATAGAATATGTTTTAGAGAATTCTTCGACCGAGTTGAAACATGA	ATG CCG ATA TTG GTT TGG CAA CTA CCG AAA AGC AAG AAG CTA AAA ACT TTG AAG TAT AGA ATA TGT TTT AGA GAA TTC TTC GAC CGA GTT GAA ACA	32	0.354167	0.218750	0.843750	0.238095	false	L1_short	drop_stop	balanced	mid_regularity	q3	150	0.192150	0.252371	true
scerevisiae	lcl|BK006943.2_cds_DAA08752.1_3081	ATGAAGATAAAAATTTCCATCGAAATTAGTCTTTCGCTCCTATCTGAACATTACAAAAGAAACGAAAACTGTATTAGTAATATGCTTGTAATTGGAGAAGGGCCGAGGGGCGAGACCATTGTGGAGCGATTTTAA	ATG AAG ATA AAA ATT TCC ATC GAA ATT AGT CTT TCG CTC CTA TCT GAA CAT TAC AAA AGA AAC GAA AAC TGT ATT AGT AAT ATG CTT GTA ATT GGA GAA GGG CCG AGG GGC GAG ACC ATT GTG GAG CGA TTT	44	0.378788	0.187500	0.958333	0.261905	false	L1_short	drop_stop	balanced	low_regularity	q1	150	0.192150	0.252371	true
scerevisiae	lcl|BK006943.2_cds_DAD54807.1_3223	ATGTGTGATGATAGCTATGATGCTGTAGAAGAATACTATTTCAACAAAAGCGTAGCCGGGATTAGTGGCCAGGAGAACTGGAATAAGCAGTTAGCTACCCAAGTGTATTCAAGAAGTTTACAACCAGAAATATTACCAACCCTAAAACCTCTTTCATGTAACAAAGAGAGGGCCAATGCAGGAAAAAGAGTTTCAGAAGAAGAGCAGATAAATGGAAAACGTAAGAGAAAAGATTAG	ATG TGT GAT GAT AGC TAT GAT GCT GTA GAA GAA TAC TAT TTC AAC AAA AGC GTA GCC GGG ATT AGT GGC CAG GAG AAC TGG AAT AAG CAG TTA GCT ACC CAA GTG TAT TCA AGA AGT TTA CAA CCA GAA ATA TTA CCA ACC CTA AAA CCT CTT TCA TGT AAC AAA GAG AGG GCC AAT GCA GGA AAA AGA GTT TCA GAA GAA GAG CAG ATA AAT GGA AAA CGT AAG AGA AAA GAT	78	0.384615	0.220833	0.908333	0.292381	false	L1_short	drop_stop	balanced	mid_regularity	q3	150	0.192150	0.252371	true
scerevisiae	lcl|BK006944.2_cds_DAA08983.1_3316	ATGTATTCAAAGATCTTGCTATACCGTAGTAACGTTCTGTTCATGAACTTTTTCTCTGTTTTTGTATGTACAATTGGTACTTTATTTTTGGTTTTCGCAGATGTCTATGTTCTTGCGTCGGCATTTTTCCAAAGTAAAAAGGAAAAAGAGACAAAGTTTAAGCATTTACACTACCAAAAAAGATCTTGTTTCTTTCTAGCAAATATACACTAA	ATG TAT TCA AAG ATC TTG CTA TAC CGT AGT AAC GTT CTG TTC ATG AAC TTT TTC TCT GTT TTT GTA TGT ACA ATT GGT ACT TTA TTT TTG GTT TTC GCA GAT GTC TAT GTT CTT GCG TCG GCA TTT TTC CAA AGT AAA AAG GAA AAA GAG ACA AAG TTT AAG CAT TTA CAC TAC CAA AAA AGA TCT TGT TTC TTT CTA GCA AAT ATA CAC	70	0.319048	0.171296	0.958333	0.238095	false	L1_short	drop_stop	balanced	low_regularity	q1	150	0.192150	0.252371	true
