species	seq_id	cds_nt	codon_tokens	num_codons	gc_content	dominant_reference_coverage	avg_window_heterogeneity	sparse_difference_ratio	has_internal_stop	length_group	terminal_stop_policy	sampling_view	regularity_group	regularity_quartile	regularity_bin_n	regularity_q1	regularity_q3	regularity_is_reportable
ecoli	lcl|U00096.3_cds_AAC73135.1_24	ATGTGCCGGCACTCGTTACGTAGTGATGGCGCAGGATTCTACCAGCTTGCGGGGTGTGAATACAGCTTTTCCGCGATAAAAATTGCAGCAGGCGGTCAGTTTCTTCCCGTGATTTGCGCCATGGCAATGAAAAGCCACTTCTTTCTGATTTCGGTACTCAATCGCCGGTTAACCTTGACCGCTGTACAAGGTATACTCGGACGATTTTCACTGTTTTGA	ATG TGC CGG CAC TCG TTA CGT AGT GAT GGC GCA GGA TTC TAC CAG CTT GCG GGG TGT GAA TAC AGC TTT TCC GCG ATA AAA ATT GCA GCA GGC GGT CAG TTT CTT CCC GTG ATT TGC GCC ATG GCA ATG AAA AGC CAC TTC TTT CTG ATT TCG GTA CTC AAT CGC CGG TTA ACC TTG ACC GCT GTA CAA GGT ATA CTC GGA CGA TTT TCA CTG TTT	72	0.490741	0.180556	0.944444	0.082011	false	L1_short	drop_stop	balanced	low_regularity	q1	150	0.192894	0.250000	true
ecoli	lcl|U00096.3_cds_AAC73483.2_374	ATGAATCTGCCTGTAAAAATCCGCCGTGACTGGCACTACTATGCGTTCGCCATTGGCCTTATATTCATTCTTAATGGCGTGGTGGGGTTACTGGGATTTGAAGCAAAAGGTTGGCAGACCTATGCCGTCGGTCTGGTGACGTGGGTGATTAGTTTCTGGCTGGCGGGGTTGATTATTCGTCGTCGCGATGAAGAAACTGAAAACGCCCAATAA	ATG AAT CTG CCT GTA AAA ATC CGC CGT GAC TGG CAC TAC TAT GCG TTC GCC ATT GGC CTT ATA TTC ATT CTT AAT GGC GTG GTG GGG TTA CTG GGA TTT GAA GCA AAA GGT TGG CAG ACC TAT GCC GTC GGT CTG GTG ACG TGG GTG ATT AGT TTC TGG CTG GCG GGG TTG ATT ATT CGT CGT CGC GAT GAA GAA ACT GAA AAC GCC CAA	70	0.495238	0.189815	0.912037	0.199735	false	L1_short	drop_stop	balanced	low_regularity	q1	150	0.192894	0.250000	true
ecoli	lcl|U00096.3_cds_AAC73492.1_383	ATGCCAACGAAACCGCCTTATCCTCGTGAAGCATATATAGTGACGATTGAAAAAGGAAAGCCAGGACAGACGGTAACCTGGTACCAACTCAGAGCCGATCATCCTAAACCAGACTCGTTGATCAGTGAACATCCGACCGCTCAGGAAGCGATGGATGCGAAAAAACGCTATGAGGACCCTGACAAAGAGTGA	ATG CCA ACG AAA CCG CCT TAT CCT CGT GAA GCA TAT ATA GTG ACG ATT GAA AAA GGA AAG CCA GGA CAG ACG GTA ACC TGG TAC CAA CTC AGA GCC GAT CAT CCT AAA CCA GAC TCG TTG ATC AGT GAA CAT CCG ACC GCT CAG GAA GCG ATG GAT GCG AAA AAA CGC TAT GAG GAC CCT GAC AAA GAG	63	0.486772	0.191964	0.901786	0.169048	false	L1_short	drop_stop	balanced	low_regularity	q1	150	0.192894	0.250000	true
ecoli	lcl|U00096.3_cds_AAC73562.1_452	ATGTCCGAAAAACCTTTAACGAAAACCGATTATTTAATGCGTTTACGTCGTTGCCAGACAATTGACACGCTGGAGCGTGTTATCGAGAAAAATAAATACGAATTATCAGATAATGAACTGGCGGTATTTTACTCAGCCGCAGATCACCGCCTCGCCGAATTGACCATGAATAAACTGTACGACAAGATCCCTTCCTCAGTATGGAAATTTATTCGCTAA	ATG TCC GAA AAA CCT TTA ACG AAA ACC GAT TAT TTA ATG CGT TTA CGT CGT TGC CAG ACA ATT GAC ACG CTG GAG CGT GTT ATC GAG AAA AAT AAA TAC GAA TTA TCA GAT AAT GAA CTG GCG GTA TTT TAC TCA GCC GCA GAT CAC CGC CTC GCC GAA TTG ACC ATG AAT AAA CTG TAC GAC AAG ATC CCT TCC TCA GTA TGG AAA TTT ATT CGC	72	0.412037	0.180556	0.916667	0.119048	false	L1_short	drop_stop	balanced	low_regularity	q1	150	0.192894	0.250000	true
ecoli	lcl|U00096.3_cds_AAC73649.1_537	ATGGCTACACCGCTTATTCGTGTCATGAACGGACACATCTACAGAGTACCAAATCGTCGTAAGCGTAAACCTGAGCTGAAGCCATCCGAAATACCAACACTGCTCGGATATACCGCCAGCTTGGTTGATAAAAAATGGTTGCGACTGGCAGCAAGGAGGAGTCATGGCTGA	ATG GCT ACA CCG CTT ATT CGT GTC ATG AAC GGA CAC ATC TAC AGA GTA CCA AAT CGT CGT AAG CGT AAA CCT GAG CTG AAG CCA TCC GAA ATA CCA ACA CTG CTC GGA TAT ACC GCC AGC TTG GTT GAT AAA AAA TGG TTG CGA CTG GCA GCA AGG AGG AGT CAT GGC	56	0.488095	0.214286	0.875000	0.134014	false	L1_short	drop_stop	balanced	mid_regularity	q2	150	0.192894	0.250000	true
ecoli	lcl|U00096.3_cds_AAC73724.1_617	ATGTCTAAGATTAAAGGTAACGTTAAGTGGTTTAATGAGTCCAAAGGATTCGGTTTCATTACTCCGGAAGACGGCAGCAAAGACGTGTTCGTACACTTCTCTGCAATCCAGACTAATGGTTTTAAAACTCTTGCTGAAGGTCAGCGCGTAGAGTTCGAAATCACTAACGGTGCCAAAGGCCCTTCTGCTGCAAACGTAATCGCTCTGTAA	ATG TCT AAG ATT AAA GGT AAC GTT AAG TGG TTT AAT GAG TCC AAA GGA TTC GGT TTC ATT ACT CCG GAA GAC GGC AGC AAA GAC GTG TTC GTA CAC TTC TCT GCA ATC CAG ACT AAT GGT TTT AAA ACT CTT GCT GAA GGT CAG CGC GTA GAG TTC GAA ATC ACT AAC GGT GCC AAA GGC CCT TCT GCT GCA AAC GTA ATC GCT CTG	69	0.444444	0.147222	0.986111	0.138889	false	L1_short	drop_stop	balanced	low_regularity	q1	150	0.192894	0.250000	true
ecoli	lcl|U00096.3_cds_AAC73793.1_681	ATGGAACTCTACAGAGAATATCCTGCATGGCTTATCTTTTTACGCCGTACTTATGCGGTTGCAGCGGGCGTTCTGGCGCTGCCTTTCATGCTTTTCTGGAAAGACCGCGCCCGCTTTTACAGCTACCTGCATCGCGTCTGGTCGAAAACCAGCGATAAACCGGTGTGGATGGATCAGGCCGAAAAGGCAACTGGTGATTTTTATTGA	ATG GAA CTC TAC AGA GAA TAT CCT GCA TGG CTT ATC TTT TTA CGC CGT ACT TAT GCG GTT GCA GCG GGC GTT CTG GCG CTG CCT TTC ATG CTT TTC TGG AAA GAC CGC GCC CGC TTT TAC AGC TAC CTG CAT CGC GTC TGG TCG AAA ACC AGC GAT AAA CCG GTG TGG ATG GAT CAG GCC GAA AAG GCA ACT GGT GAT TTT TAT	68	0.504902	0.208333	0.902778	0.177249	false	L1_short	drop_stop	balanced	mid_regularity	q2	150	0.192894	0.250000	true
ecoli	lcl|U00096.3_cds_AAC73849.1_737	ATGTTAGAGTTATTAAAAAGTCTGGTATTCGCCGTAATCATGGTACCTGTCGTGATGGCCATCATCCTGGGTCTGATTTACGGTCTTGGTGAAGTATTCAACATCTTTTCTGGTGTTGGTAAAAAAGACCAGCCCGGACAAAATCATTGA	ATG TTA GAG TTA TTA AAA AGT CTG GTA TTC GCC GTA ATC ATG GTA CCT GTC GTG ATG GCC ATC ATC CTG GGT CTG ATT TAC GGT CTT GGT GAA GTA TTC AAC ATC TTT TCT GGT GTT GGT AAA AAA GAC CAG CCC GGA CAA AAT CAT	49	0.414966	0.392857	0.857143	0.119048	false	L1_short	drop_stop	balanced	high_regularity	q4	150	0.192894	0.250000	true
ecoli	lcl|U00096.3_cds_AAC73967.1_857	ATGGAAAAGGGTACTGTTAAGTGGTTCAACAATGCCAAAGGGTTTGGTTTCATCTGCCCTGAAGGCGGCGGCGAAGATATTTTCGCTCATTATTCCACCATTCAGATGGATGGTTACAGAACGCTAAAAGCTGGACAATCCGTTCAGTTTGATGTCCACCAGGGGCCAAAAGGCAATCACGCCAGTGTTATTGTGCCCGTCGAAGTAGAAGCGGCAGTCGCATAG	ATG GAA AAG GGT ACT GTT AAG TGG TTC AAC AAT GCC AAA GGG TTT GGT TTC ATC TGC CCT GAA GGC GGC GGC GAA GAT ATT TTC GCT CAT TAT TCC ACC ATT CAG ATG GAT GGT TAC AGA ACG CTA AAA GCT GGA CAA TCC GTT CAG TTT GAT GTC CAC CAG GGG CCA AAA GGC AAT CAC GCC AGT GTT ATT GTG CCC GTC GAA GTA GAA GCG GCA GTC GCA	74	0.486486	0.225000	0.937500	0.143810	false	L1_short	drop_stop	balanced	mid_regularity	q3	150	0.192894	0.250000	true
ecoli	lcl|U00096.3_cds_AAC73970.1_861	ATGGCCAAAGAAGACAATATTGAAATGCAAGGTACCGTTCTTGAAACGTTGCCTAATACCATGTTCCGCGTAGAGTTAGAAAACGGTCACGTGGTTACTGCACACATCTCCGGTAAAATGCGCAAAAACTACATCCGCATCCTGACGGGCGACAAAGTGACTGTTGAACTGACCCCGTACGACCTGAGCAAAGGCCGCATTGTCTTCCGTAGTCGCTGA	ATG GCC AAA GAA GAC AAT ATT GAA ATG CAA GGT ACC GTT CTT GAA ACG TTG CCT AAT ACC ATG TTC CGC GTA GAG TTA GAA AAC GGT CAC GTG GTT ACT GCA CAC ATC TCC GGT AAA ATG CGC AAA AAC TAC ATC CGC ATC CTG ACG GGC GAC AAA GTG ACT GTT GAA CTG ACC CCG TAC GAC CTG AGC AAA GGC CGC ATT GTC TTC CGT AGT CGC	72	0.486111	0.180556	0.930556	0.158730	false	L1_short	drop_stop	balanced	low_regularity	q1	150	0.192894	0.250000	true
ecoli	lcl|U00096.3_cds_AAC74003.1_894	ATGGATCATCGTCTGCTTGAAATCATTGCCTGCCCGGTTTGCAACGGAAAACTTTGGTATAACCAGGAAAAACAAGAGCTTATTTGCAAACTGGACAACCTCGCTTTCCCGCTGCGTGATGGCATTCCAGTGTTGCTGGAAACGGAAGCCCGCGTGCTGACTGCTGATGAGAGTAAATCATGA	ATG GAT CAT CGT CTG CTT GAA ATC ATT GCC TGC CCG GTT TGC AAC GGA AAA CTT TGG TAT AAC CAG GAA AAA CAA GAG CTT ATT TGC AAA CTG GAC AAC CTC GCT TTC CCG CTG CGT GAT GGC ATT CCA GTG TTG CTG GAA ACG GAA GCC CGC GTG CTG ACT GCT GAT GAG AGT AAA TCA	60	0.483333	0.171875	0.968750	0.095238	false	L1_short	drop_stop	balanced	low_regularity	q1	150	0.192894	0.250000	true
ecoli	lcl|U00096.3_cds_AAC74075.1_968	ATGTCTAATAAAATGACTGGTTTAGTAAAATGGTTTAACGCAGATAAAGGTTTTGGCTTTATCACTCCTGATGATGGCAGCAAAGACGTTTTCGTCCATTTCACCGCCATCCAGAGCAATGAATTCCGCACGCTGAACGAAAATCAGAAAGTTGAATTTTCTATTGAGCAGGGGCAACGTGGCCCCGCGGCAGCGAACGTTGTTACGCTCTAA	ATG TCT AAT AAA ATG ACT GGT TTA GTA AAA TGG TTT AAC GCA GAT AAA GGT TTT GGC TTT ATC ACT CCT GAT GAT GGC AGC AAA GAC GTT TTC GTC CAT TTC ACC GCC ATC CAG AGC AAT GAA TTC CGC ACG CTG AAC GAA AAT CAG AAA GTT GAA TTT TCT ATT GAG CAG GGG CAA CGT GGC CCC GCG GCA GCG AAC GTT GTT ACG CTC	70	0.447619	0.203704	0.925926	0.066138	false	L1_short	drop_stop	balanced	mid_regularity	q2	150	0.192894	0.250000	true
ecoli	lcl|U00096.3_cds_AAC74076.1_970	ATGCGCCGCTGGATTTCACAAAATAATATCAGGCTCCCTCGTGGAGCCTTTTTTATATCTGCCTTATTTTTCTTCAACGCTGTATGTATAGTAAGCGATAACCTGTTGATTATTGAATCTTTCGGGGAGATGGCTTATAACATTTCTTACCTGACCAGGGTACCGGGAACCAACACCTTACTGGCGTGTTGCTGTCTTTTAAGACCAGAAGAGGTTAACAGTGAATATTGA	ATG CGC CGC TGG ATT TCA CAA AAT AAT ATC AGG CTC CCT CGT GGA GCC TTT TTT ATA TCT GCC TTA TTT TTC TTC AAC GCT GTA TGT ATA GTA AGC GAT AAC CTG TTG ATT ATT GAA TCT TTC GGG GAG ATG GCT TAT AAC ATT TCT TAC CTG ACC AGG GTA CCG GGA ACC AAC ACC TTA CTG GCG TGT TGC TGT CTT TTA AGA CCA GAA GAG GTT AAC AGT GAA TAT	76	0.416667	0.212500	0.925000	0.093333	false	L1_short	drop_stop	balanced	mid_regularity	q2	150	0.192894	0.250000	true
ecoli	lcl|U00096.3_cds_AAC74088.1_983	ATGCCAACTCAAGAAGCGAAAGCTCATCACGTCGGTGAATGGGCATCTCTGCGCAATACGTCGCCGGAAATAGCCGAGGCCATTTTCGAAGTCGCCGGGTACGACGAAAAAATGGCGGAAAAGATTTGGGAAGAAGGTAGTGATGAAGTGTTAGTCAAAGCCTTTGCTAAGACCGATAAAGATTCGCTTTTTTGGGGCGAACAGACCATCGAACGTAAAAACGTTTAA	ATG CCA ACT CAA GAA GCG AAA GCT CAT CAC GTC GGT GAA TGG GCA TCT CTG CGC AAT ACG TCG CCG GAA ATA GCC GAG GCC ATT TTC GAA GTC GCC GGG TAC GAC GAA AAA ATG GCG GAA AAG ATT TGG GAA GAA GGT AGT GAT GAA GTG TTA GTC AAA GCC TTT GCT AAG ACC GAT AAA GAT TCG CTT TTT TGG GGC GAA CAG ACC ATC GAA CGT AAA AAC GTT	75	0.475556	0.220833	0.925000	0.177143	false	L1_short	drop_stop	balanced	mid_regularity	q3	150	0.192894	0.250000	true
ecoli	lcl|U00096.3_cds_AAC74090.2_985	ATGGCAAACCATCGAGGCGGTTCCGGCAATTTTGCAGAAGACCGCGAAAGAGCATCAGAAGCAGGTAAAAAAGGTGGACAGCACAGCGGGGGTAATTTCAAGAATGACCCGCAGCGCGCATCTGAAGCAGGTAAAAAAGGTGGTAAGAGCAGTCACGGCAAAAGCGACAACTAG	ATG GCA AAC CAT CGA GGC GGT TCC GGC AAT TTT GCA GAA GAC CGC GAA AGA GCA TCA GAA GCA GGT AAA AAA GGT GGA CAG CAC AGC GGG GGT AAT TTC AAG AAT GAC CCG CAG CGC GCA TCT GAA GCA GGT AAA AAA GGT GGT AAG AGC AGT CAC GGC AAA AGC GAC AAC	57	0.514620	0.328125	0.875000	0.202381	false	L1_short	drop_stop	balanced	high_regularity	q4	150	0.192894	0.250000	true
ecoli	lcl|U00096.3_cds_AAC74134.1_1025	ATGCGTTTAATTGTGGTGAGCATCATGGTGACCTTGCTGAGTGGCTGTGGCAGCATTATTAGTCGCACTATACCGGGGCAGGGGCATGGCAACCAATATTATCCCGGTGTGCAATGGGATGTGCGTGACTCCGCCTGGCGTTATGTCACGATCCTTGATCTGCCATTCTCTCTGGTTTTTGATACTTTACTGCTGCCGATCGACATTCATCATGGCCCGTATGAGTGA	ATG CGT TTA ATT GTG GTG AGC ATC ATG GTG ACC TTG CTG AGT GGC TGT GGC AGC ATT ATT AGT CGC ACT ATA CCG GGG CAG GGG CAT GGC AAC CAA TAT TAT CCC GGT GTG CAA TGG GAT GTG CGT GAC TCC GCC TGG CGT TAT GTC ACG ATC CTT GAT CTG CCA TTC TCT CTG GTT TTT GAT ACT TTA CTG CTG CCG ATC GAC ATT CAT CAT GGC CCG TAT GAG	75	0.506667	0.233333	0.912500	0.100000	false	L1_short	drop_stop	balanced	mid_regularity	q3	150	0.192894	0.250000	true
ecoli	lcl|U00096.3_cds_AAC74173.1_1063	ATGGCCGTACAACAGAATAAACCAACCCGTTCCAAACGTGGCATGCGTCGTTCCCATGACGCGCTGACCGCAGTCACCAGCCTGTCTGTAGACAAAACTTCTGGTGAAAAACACCTGCGTCACCACATCACTGCCGACGGTTACTACCGCGGCCGCAAGGTCATCGCTAAGTAA	ATG GCC GTA CAA CAG AAT AAA CCA ACC CGT TCC AAA CGT GGC ATG CGT CGT TCC CAT GAC GCG CTG ACC GCA GTC ACC AGC CTG TCT GTA GAC AAA ACT TCT GGT GAA AAA CAC CTG CGT CAC CAC ATC ACT GCC GAC GGT TAC TAC CGC GGC CGC AAG GTC ATC GCT AAG	57	0.549708	0.296875	0.937500	0.133929	false	L1_short	drop_stop	balanced	high_regularity	q4	150	0.192894	0.250000	true
ecoli	lcl|U00096.3_cds_AAC74234.1_1125	ATGATCATGCTGATTCTCGCGCCTCTGGTGGGCGTGCTGGGTGCGCTTTTGCTGGCGTATGGTGCCTGGCTGATTTATCCCCCGGCGGGTTTTGTTGTTGCCGGGGCGCTGTGCCTGTTCTGGTCGTGGCTGGTGGCGCGATATCTCGACCGTACACAGTCGTCTGTCGGCGGAGGTAAATAG	ATG ATC ATG CTG ATT CTC GCG CCT CTG GTG GGC GTG CTG GGT GCG CTT TTG CTG GCG TAT GGT GCC TGG CTG ATT TAT CCC CCG GCG GGT TTT GTT GTT GCC GGG GCG CTG TGC CTG TTC TGG TCG TGG CTG GTG GCG CGA TAT CTC GAC CGT ACA CAG TCG TCT GTC GGC GGA GGT AAA	60	0.605556	0.218750	0.906250	0.202381	false	L1_short	drop_stop	balanced	mid_regularity	q3	150	0.192894	0.250000	true
ecoli	lcl|U00096.3_cds_AAC74248.1_1139	ATGCATCAAAATTCAGTGACTTTAGATTCTGCGGGAGCAATCACTCGTTACTTTGCAAAAGCTAACTTGCATACTCAGCAGGAAACTCTCGGGGAAATTGTGACTGAGATTTTGAAAGATGGACGTAATCTGAGTCGAAAGTCGCTTTGTGCCAAACTTCTTTGCCGACTGGAACACGCGACTGGGGAAGAGGAACAGAAACATTATAATGCACTAATTGGGTTGCTTTTTGAATAA	ATG CAT CAA AAT TCA GTG ACT TTA GAT TCT GCG GGA GCA ATC ACT CGT TAC TTT GCA AAA GCT AAC TTG CAT ACT CAG CAG GAA ACT CTC GGG GAA ATT GTG ACT GAG ATT TTG AAA GAT GGA CGT AAT CTG AGT CGA AAG TCG CTT TGT GCC AAA CTT CTT TGC CGA CTG GAA CAC GCG ACT GGG GAA GAG GAA CAG AAA CAT TAT AAT GCA CTA ATT GGG TTG CTT TTT GAA	78	0.423077	0.191667	0.912500	0.173333	false	L1_short	drop_stop	balanced	low_regularity	q1	150	0.192894	0.250000	true
ecoli	lcl|U00096.3_cds_AAC74365.1_1265	ATGTTTGTAACGAGCAAAAAAATGACCGCGGCTGTTCTGGCAATTACTTTGGCAATGTCTCTGAGTGCCTGTTCTAACTGGTCTAAACGGGACCGCAACACCGCAATCGGCGCGGGTGCAGGGGCATTAGGCGGTGCAGTACTGACCGATGGCAGTACGTTGGGTACATTAGGTGGTGCAGCTGTCGGAGGTGTTATTGGTCACCAGGTCGGTAAATAA	ATG TTT GTA ACG AGC AAA AAA ATG ACC GCG GCT GTT CTG GCA ATT ACT TTG GCA ATG TCT CTG AGT GCC TGT TCT AAC TGG TCT AAA CGG GAC CGC AAC ACC GCA ATC GGC GCG GGT GCA GGG GCA TTA GGC GGT GCA GTA CTG ACC GAT GGC AGT ACG TTG GGT ACA TTA GGT GGT GCA GCT GTC GGA GGT GTT ATT GGT CAC CAG GTC GGT AAA	72	0.527778	0.222222	0.888889	0.163492	false	L1_short	drop_stop	balanced	mid_regularity	q3	150	0.192894	0.250000	true
ecoli	lcl|U00096.3_cds_AAC74387.1_1291	ATGAGCGCGCTATTTCTGGCTATTCCGTTAACCATTTTTGTGCTGTTTGTTTTACCGATCTGGTTATGGCTGCATTACAGCAATCGTTCTGGTCGCAGTGAATTGTCGCAAAGTGAGCAGCAGCGATTAGCGCAACTGGCTGATGAAGCAAAACGGATGCGCGAACGTATTCAGGCGCTGGAATCTATTCTTGATGCAGAACATCCGAACTGGAGGGATCGCTAA	ATG AGC GCG CTA TTT CTG GCT ATT CCG TTA ACC ATT TTT GTG CTG TTT GTT TTA CCG ATC TGG TTA TGG CTG CAT TAC AGC AAT CGT TCT GGT CGC AGT GAA TTG TCG CAA AGT GAG CAG CAG CGA TTA GCG CAA CTG GCT GAT GAA GCA AAA CGG ATG CGC GAA CGT ATT CAG GCG CTG GAA TCT ATT CTT GAT GCA GAA CAT CCG AAC TGG AGG GAT CGC	74	0.481982	0.225000	0.925000	0.126190	false	L1_short	drop_stop	balanced	mid_regularity	q3	150	0.192894	0.250000	true
ecoli	lcl|U00096.3_cds_AAC74429.1_1336	ATGTATAAAATTACCGCCACTATTGAAAAGGAAGGTGGCACTCCTACTAACTGGACAAGATATTCAAAATCTAAACTAACGAAATCAGAATGCGAAAAAATGCTCTCAGGTAAAAAAGAAGCAGGCGTTTCCAGAGAGCAGAAAGTAAAACTGATAAATTTTAATTGCGAGAAACTTCAGTCCTCGAGAATTGCATTGTATTCAAATTAA	ATG TAT AAA ATT ACC GCC ACT ATT GAA AAG GAA GGT GGC ACT CCT ACT AAC TGG ACA AGA TAT TCA AAA TCT AAA CTA ACG AAA TCA GAA TGC GAA AAA ATG CTC TCA GGT AAA AAA GAA GCA GGC GTT TCC AGA GAG CAG AAA GTA AAA CTG ATA AAT TTT AAT TGC GAG AAA CTT CAG TCC TCG AGA ATT GCA TTG TAT TCA AAT	69	0.352657	0.216667	0.888889	0.240476	false	L1_short	drop_stop	balanced	mid_regularity	q2	150	0.192894	0.250000	true
ecoli	lcl|U00096.3_cds_AAC74430.1_1337	ATGAGATATGACAATGTTAAACCATGTCCATTTTGTGGTTGTCCATCAGTAACGGTGAAAGCCATTTCAGGATATTACCGAGCGAAGTGTAACGGATGCGAATCCCGAACCGGTTATGGTGGAAGTGAAAAAGAAGCACTCGAAAGATGGAATAAACGAACCACTGGAAATAATAATGGAGGTGTTCATGTATAA	ATG AGA TAT GAC AAT GTT AAA CCA TGT CCA TTT TGT GGT TGT CCA TCA GTA ACG GTG AAA GCC ATT TCA GGA TAT TAC CGA GCG AAG TGT AAC GGA TGC GAA TCC CGA ACC GGT TAT GGT GGA AGT GAA AAA GAA GCA CTC GAA AGA TGG AAT AAA CGA ACC ACT GGA AAT AAT AAT GGA GGT GTT CAT GTA	64	0.411458	0.234375	0.875000	0.257143	false	L1_short	drop_stop	balanced	mid_regularity	q3	150	0.192894	0.250000	true
ecoli	lcl|U00096.3_cds_AAC74434.2_1342	ATGATTGCACATCACTTCGGAACTGATGAAATACCACGTCAGTGTGTGACTCCTGGCGATTATGTTCTTCATGAAGGCCGGACATATATTGCCTCGGCAAACAATATTAAAAAGCGAAAACTATATATTCGTAACCTGACCACAAAAACATTCATTACTGACCGCATGATTAAAGTCTTCCTCGGTCGTGATGGTTTACCTGTAAAGGCGGAGTCATGGTGA	ATG ATT GCA CAT CAC TTC GGA ACT GAT GAA ATA CCA CGT CAG TGT GTG ACT CCT GGC GAT TAT GTT CTT CAT GAA GGC CGG ACA TAT ATT GCC TCG GCA AAC AAT ATT AAA AAG CGA AAA CTA TAT ATT CGT AAC CTG ACC ACA AAA ACA TTC ATT ACT GAC CGC ATG ATT AAA GTC TTC CTC GGT CGT GAT GGT TTA CCT GTA AAG GCG GAG TCA TGG	73	0.420091	0.225000	0.987500	0.121429	false	L1_short	drop_stop	balanced	mid_regularity	q3	150	0.192894	0.250000	true
ecoli	lcl|U00096.3_cds_AAC74437.2_1345	ATGGTGCATTACGAAGTAGTTCAGTATTTGATGGATTGTTGCGGTATCACTTACAACCAGGCTGTGCAGGCTTTACGCAGCAACGACTGGGATCTCTGGCAGGCAGAAGTCGCTATACGTAGCAACAAGATGTGA	ATG GTG CAT TAC GAA GTA GTT CAG TAT TTG ATG GAT TGT TGC GGT ATC ACT TAC AAC CAG GCT GTG CAG GCT TTA CGC AGC AAC GAC TGG GAT CTC TGG CAG GCA GAA GTC GCT ATA CGT AGC AAC AAG ATG	44	0.477273	0.166667	0.958333	0.206349	false	L1_short	drop_stop	balanced	low_regularity	q1	150	0.192894	0.250000	true
ecoli	lcl|U00096.3_cds_AAC74501.1_1406	ATGAAAAAACTGGCACTTATTTTGTTTATGGGAACGCTTGTTTCCTTTTATGCCGATGCCGGGCGCAAACCCTGTTCTGGTTCGAAAGGGGGGATCTCACACTGTACGGCAGGCGGCAAATTTGTCTGTAATGATGGTTCTATTAGTGCATCGAAAAAAACATGCACTAACTGA	ATG AAA AAA CTG GCA CTT ATT TTG TTT ATG GGA ACG CTT GTT TCC TTT TAT GCC GAT GCC GGG CGC AAA CCC TGT TCT GGT TCG AAA GGG GGG ATC TCA CAC TGT ACG GCA GGC GGC AAA TTT GTC TGT AAT GAT GGT TCT ATT AGT GCA TCG AAA AAA ACA TGC ACT AAC	57	0.444444	0.328125	0.906250	0.139881	false	L1_short	drop_stop	balanced	high_regularity	q4	150	0.192894	0.250000	true
ecoli	lcl|U00096.3_cds_AAC74508.2_1414	ATGTTTCCAGAATACCGAGATTTAATATCCCGTCTGAAAAACGAAAATCCTCGCTTTATGTCCTTGTTCGATAAACACAATAAACTTGATCATGAAATTGCCAGAAAGGAAGGTTCCGACGGTCGAGGGTACAATGCGGAAGTGGTCCGCATGAAAAAACAAAAGCTACAGTTAAAAGATGAGATGCTCAAAATCCTGCAGCAGGAGAGCGTCAAAGAGGTGTAA	ATG TTT CCA GAA TAC CGA GAT TTA ATA TCC CGT CTG AAA AAC GAA AAT CCT CGC TTT ATG TCC TTG TTC GAT AAA CAC AAT AAA CTT GAT CAT GAA ATT GCC AGA AAG GAA GGT TCC GAC GGT CGA GGG TAC AAT GCG GAA GTG GTC CGC ATG AAA AAA CAA AAG CTA CAG TTA AAA GAT GAG ATG CTC AAA ATC CTG CAG CAG GAG AGC GTC AAA GAG GTG	74	0.418919	0.212500	0.950000	0.271429	false	L1_short	drop_stop	balanced	mid_regularity	q2	150	0.192894	0.250000	true
ecoli	lcl|U00096.3_cds_AAC74518.1_1424	ATGTTTACGAAGGCGTTATCGGTTGTCTTATTAACGTGTGCTCTGTTTTCAGGACAACTCATGGCAGGGCACAAAGGACATGAATTTGTGTGGGTAAAGAATGTGGATCATCAGCTGCGTCATGAAGCGGACAGCGATGAATTGCGTGCTGTGGCGGAAGAGTCGGCGGAAGGTTTGCGCGAGCATTTTTACTGGCAAAAATCGCGCAAACCAGAAGCGGGACAACGTTGA	ATG TTT ACG AAG GCG TTA TCG GTT GTC TTA TTA ACG TGT GCT CTG TTT TCA GGA CAA CTC ATG GCA GGG CAC AAA GGA CAT GAA TTT GTG TGG GTA AAG AAT GTG GAT CAT CAG CTG CGT CAT GAA GCG GAC AGC GAT GAA TTG CGT GCT GTG GCG GAA GAG TCG GCG GAA GGT TTG CGC GAG CAT TTT TAC TGG CAA AAA TCG CGC AAA CCA GAA GCG GGA CAA CGT	76	0.491228	0.187500	0.950000	0.221429	false	L1_short	drop_stop	balanced	low_regularity	q1	150	0.192894	0.250000	true
ecoli	lcl|U00096.3_cds_AAC74527.2_1434	ATGTCTCTCTATCAACACATGCTTGTTTTTTATGCGGTTATGGCAGCAATCGCATTTCTTATCACCTGGTTTCTTTCTCACGATAAGAAACGCATCCGTTTCTTAAGCGCCTTTCTGGTGGGGGCAACATGGCCGATGAGTTTCCCGGTGGCGCTGTTGTTTTCACTGTTTTAA	ATG TCT CTC TAT CAA CAC ATG CTT GTT TTT TAT GCG GTT ATG GCA GCA ATC GCA TTT CTT ATC ACC TGG TTT CTT TCT CAC GAT AAG AAA CGC ATC CGT TTC TTA AGC GCC TTT CTG GTG GGG GCA ACA TGG CCG ATG AGT TTC CCG GTG GCG CTG TTG TTT TCA CTG TTT	57	0.456140	0.296875	0.906250	0.139881	false	L1_short	drop_stop	balanced	high_regularity	q4	150	0.192894	0.250000	true
ecoli	lcl|U00096.3_cds_AAC74528.1_1435	ATGTCGCATCTGGATGAAGTCATCGCGCGCGTGGATGCCGCGATTGAAGAGAGCGTCATTGCCCATATGAACGAATTATTAATCGCCCTGAGCGATGACGCGGAGTTAAGTCGGGAAGATCGCTACACCCAGCAGCAACGTCTGCGCACAGCGATCGCCCATCACGGTCGCAAGCATAAAGAAGATATGGAAGCGCGCCACGAACAGTTAACCAAAGGCGGCACCATCCTCTGA	ATG TCG CAT CTG GAT GAA GTC ATC GCG CGC GTG GAT GCC GCG ATT GAA GAG AGC GTC ATT GCC CAT ATG AAC GAA TTA TTA ATC GCC CTG AGC GAT GAC GCG GAG TTA AGT CGG GAA GAT CGC TAC ACC CAG CAG CAA CGT CTG CGC ACA GCG ATC GCC CAT CAC GGT CGC AAG CAT AAA GAA GAT ATG GAA GCG CGC CAC GAA CAG TTA ACC AAA GGC GGC ACC ATC CTC	77	0.545455	0.202500	0.930000	0.157143	false	L1_short	drop_stop	balanced	mid_regularity	q2	150	0.192894	0.250000	true
ecoli	lcl|U00096.3_cds_AAC74543.1_1448	ATGCCGCACATCGACATTAAATGTTTTCCGCGTGAACTGGACGAACAACAAAAAGCAGCACTTGCTGCAGATATTACCGACGTTATTATTCGTCATCTGAACAGTAAAGACAGTTCGATAAGCATTGCTCTACAGCAGATTCAACCAGAATCTTGGCAAGCTATCTGGGATGCCGAAATCGCGCCCCAAATGGAGGCTTTGATAAAGAAACCTGGTTATAGCATGAATGCTTAA	ATG CCG CAC ATC GAC ATT AAA TGT TTT CCG CGT GAA CTG GAC GAA CAA CAA AAA GCA GCA CTT GCT GCA GAT ATT ACC GAC GTT ATT ATT CGT CAT CTG AAC AGT AAA GAC AGT TCG ATA AGC ATT GCT CTA CAG CAG ATT CAA CCA GAA TCT TGG CAA GCT ATC TGG GAT GCC GAA ATC GCG CCC CAA ATG GAG GCT TTG ATA AAG AAA CCT GGT TAT AGC ATG AAT GCT	77	0.437229	0.232500	0.887500	0.141190	false	L1_short	drop_stop	balanced	mid_regularity	q3	150	0.192894	0.250000	true
ecoli	lcl|U00096.3_cds_AAC74553.1_1466	ATGAAATCGAACCGTCAGGCACGTCATATTCTTGGACTGGACCATAAAATTTCTAACCAGCGCAAAATAGTTACCGAAGGTGACAAATCCAGCGTAGTAAATAACCCAACCGGCAGAAAACGCCCCGCTGAAAAGTAA	ATG AAA TCG AAC CGT CAG GCA CGT CAT ATT CTT GGA CTG GAC CAT AAA ATT TCT AAC CAG CGC AAA ATA GTT ACC GAA GGT GAC AAA TCC AGC GTA GTA AAT AAC CCA ACC GGC AGA AAA CGC CCC GCT GAA AAG	45	0.451852	0.179167	0.958333	0.170635	false	L1_short	drop_stop	balanced	low_regularity	q1	150	0.192894	0.250000	true
ecoli	lcl|U00096.3_cds_AAC74554.2_1467	ATGTTTACTTATTATCAGGCAGAAAATTCAACAGCAGAACCCGCTCTGGTTAATGCCATTGAGCAAGGCCTTCGGGCACAGCATGGTGTTGTCACTGAAGATGACATTCTCATGGAGCTGACCAAATGGGTTGAAGCTTCTGATAACGACATCCTCAGTGATATCTACCAGCAAACGATCAATTATGTGGTCAGTGGCCAGCACCCTACGCTTTAA	ATG TTT ACT TAT TAT CAG GCA GAA AAT TCA ACA GCA GAA CCC GCT CTG GTT AAT GCC ATT GAG CAA GGC CTT CGG GCA CAG CAT GGT GTT GTC ACT GAA GAT GAC ATT CTC ATG GAG CTG ACC AAA TGG GTT GAA GCT TCT GAT AAC GAC ATC CTC AGT GAT ATC TAC CAG CAA ACG ATC AAT TAT GTG GTC AGT GGC CAG CAC CCT ACG CTT	71	0.460094	0.154762	0.972222	0.134921	false	L1_short	drop_stop	balanced	low_regularity	q1	150	0.192894	0.250000	true
ecoli	lcl|U00096.3_cds_AAC74573.1_1488	ATGCATGCGACCACAGTGAAAAACAAAATCACGCAAAGAGACAACTATAAAGAAATCATGTCTGCAATTGTGGTTGTCTTATTACTGACACTTACGTTGATAGCCATTTTTTCGGCAATTGATCAGCTGAGTATTTCAGAAATGGGTCGCATTGCAAGAGATCTTACACATTTCATTATCAATAGTTTGCAAGGCTGA	ATG CAT GCG ACC ACA GTG AAA AAC AAA ATC ACG CAA AGA GAC AAC TAT AAA GAA ATC ATG TCT GCA ATT GTG GTT GTC TTA TTA CTG ACA CTT ACG TTG ATA GCC ATT TTT TCG GCA ATT GAT CAG CTG AGT ATT TCA GAA ATG GGT CGC ATT GCA AGA GAT CTT ACA CAT TTC ATT ATC AAT AGT TTG CAA GGC	65	0.374359	0.250000	0.972222	0.227513	false	L1_short	drop_stop	balanced	high_regularity	q3	150	0.192894	0.250000	true
ecoli	lcl|U00096.3_cds_AAC74605.1_1517	ATGAAACCACTTTCATCCGCAATAGCAGCTGCGCTTATTCTCTTTTCCGCGCAGGGCGTTGCGGAACAAACCACGCAGCCAGTTGTTACTTCTTGTGCCAATGTCGTGGTTGTTCCCCCATCGCAGGAACACCCACCGTTTGATTTAAATCACATGGGTACTGGCAGTGATAAGTCGGATGCGCTCGGCGTGCCCTATTATAATCAACACGCTATGTAG	ATG AAA CCA CTT TCA TCC GCA ATA GCA GCT GCG CTT ATT CTC TTT TCC GCG CAG GGC GTT GCG GAA CAA ACC ACG CAG CCA GTT GTT ACT TCT TGT GCC AAT GTC GTG GTT GTT CCC CCA TCG CAG GAA CAC CCA CCG TTT GAT TTA AAT CAC ATG GGT ACT GGC AGT GAT AAG TCG GAT GCG CTC GGC GTG CCC TAT TAT AAT CAA CAC GCT ATG	72	0.504630	0.194444	0.930556	0.150794	false	L1_short	drop_stop	balanced	mid_regularity	q2	150	0.192894	0.250000	true
ecoli	lcl|U00096.3_cds_AAC74614.1_1528	ATGACGACCTACGATCGTAACCGTAACGCAATCACCACTGGCAGCCGTGTTATGGTTAGCGGCACCGGTCACACTGGCAAGATCCTGTCGATTGATACTGAAGGTCTGACCGCTGAGCAAATCCGCCGCGGAAAAACCGTAGTTGTTGAAGGTTGTGAAGAGAAACTGGCACCACTGGACCTGATTCGTCTCGGCATGAACTAA	ATG ACG ACC TAC GAT CGT AAC CGT AAC GCA ATC ACC ACT GGC AGC CGT GTT ATG GTT AGC GGC ACC GGT CAC ACT GGC AAG ATC CTG TCG ATT GAT ACT GAA GGT CTG ACC GCT GAG CAA ATC CGC CGC GGA AAA ACC GTA GTT GTT GAA GGT TGT GAA GAG AAA CTG GCA CCA CTG GAC CTG ATT CGT CTC GGC ATG AAC	67	0.527363	0.217593	0.930556	0.137566	false	L1_short	drop_stop	balanced	mid_regularity	q3	150	0.192894	0.250000	true
ecoli	lcl|U00096.3_cds_AAC74617.2_1532	ATGAAATCAAAAGACACCCTAAAGTGGTTCCCTGCGCAGCTTCCTGAAGTAAGAATTATCCTAGGGGATGCTGTAGTGGAAGTAGCAAAACAGGGAAGACCTATCAATACCAGAACATTGCTTGATTACATTGAAGGAAACATAAAGAAAAAATCATGGCTGGATAACAAAGAATTATTACAAACAGCGATATCAGTTCTTAAAGACAACCAAAATTTAAATGGTAAAATGTAA	ATG AAA TCA AAA GAC ACC CTA AAG TGG TTC CCT GCG CAG CTT CCT GAA GTA AGA ATT ATC CTA GGG GAT GCT GTA GTG GAA GTA GCA AAA CAG GGA AGA CCT ATC AAT ACC AGA ACA TTG CTT GAT TAC ATT GAA GGA AAC ATA AAG AAA AAA TCA TGG CTG GAT AAC AAA GAA TTA TTA CAA ACA GCG ATA TCA GTT CTT AAA GAC AAC CAA AAT TTA AAT GGT AAA ATG	77	0.359307	0.207500	0.925000	0.248810	false	L1_short	drop_stop	balanced	mid_regularity	q2	150	0.192894	0.250000	true
ecoli	lcl|U00096.3_cds_AAC74625.1_1543	ATGTCTAACAAAATGACTGGTTTAGTGAAATGGTTTAACCCTGAAAAAGGTTTTGGTTTCATCACGCCGAAAGATGGCAGCAAAGATGTGTTTGTCCATTTCTCAGCAATTCAGAGCAACGATTTCAAAACATTAACTGAGAATCAGGAAGTTGAATTTGGTATTGAGAACGGACCTAAAGGTCCTGCCGCTGTTCATGTAGTGGCGCTTTGA	ATG TCT AAC AAA ATG ACT GGT TTA GTG AAA TGG TTT AAC CCT GAA AAA GGT TTT GGT TTC ATC ACG CCG AAA GAT GGC AGC AAA GAT GTG TTT GTC CAT TTC TCA GCA ATT CAG AGC AAC GAT TTC AAA ACA TTA ACT GAG AAT CAG GAA GTT GAA TTT GGT ATT GAG AAC GGA CCT AAA GGT CCT GCC GCT GTT CAT GTA GTG GCG CTT	70	0.404762	0.212963	0.916667	0.143915	false	L1_short	drop_stop	balanced	mid_regularity	q2	150	0.192894	0.250000	true
ecoli	lcl|U00096.3_cds_AAC74629.2_1548	ATGAAATCAATGGATAAGTTAACAACAGGTGTTGCCTATGGCACATCGGCGGGTAATGCTGGTTTCTGGGCATTGCAGTTACTCGATAAAGTAACTCCGTCACAGTGGGCTGCAATCGGTGTGCTGGGTAGCCTGGTTTTTGGCCTGCTGACGTATCTGACAAATCTTTATTTCAAGATTAAAGAAGACAGGCGTAAGGCTGCGAGAGGAGAGTAA	ATG AAA TCA ATG GAT AAG TTA ACA ACA GGT GTT GCC TAT GGC ACA TCG GCG GGT AAT GCT GGT TTC TGG GCA TTG CAG TTA CTC GAT AAA GTA ACT CCG TCA CAG TGG GCT GCA ATC GGT GTG CTG GGT AGC CTG GTT TTT GGC CTG CTG ACG TAT CTG ACA AAT CTT TAT TTC AAG ATT AAA GAA GAC AGG CGT AAG GCT GCG AGA GGA GAG	71	0.469484	0.210317	0.916667	0.128042	false	L1_short	drop_stop	balanced	mid_regularity	q2	150	0.192894	0.250000	true
ecoli	lcl|U00096.3_cds_AAC74635.1_1556	ATGAAGCAGCAAAAGGCGATGTTAATCGCCCTGATCGTCATCTGTTTAACCGTCATAGTGACGGCACTGGTAACGAGGAAAGACCTCTGCGAGGTACGAATCCGAACCGGCCAGACGGAGGTCGCTGTCTTCACAGCTTACGAACCTGAGGAGTAA	ATG AAG CAG CAA AAG GCG ATG TTA ATC GCC CTG ATC GTC ATC TGT TTA ACC GTC ATA GTG ACG GCA CTG GTA ACG AGG AAA GAC CTC TGC GAG GTA CGA ATC CGA ACC GGC CAG ACG GAG GTC GCT GTC TTC ACA GCT TAC GAA CCT GAG GAG	51	0.529412	0.291667	0.827381	0.120408	false	L1_short	drop_stop	balanced	high_regularity	q4	150	0.192894	0.250000	true
